小程序名称,评价人数,人气,好评率,分类,标签,作者,发布时间,小程序介绍,评分
表情搜搜,0,9291,0%,社交表情头像,搞笑段子社交趣味阅读表情,表情搜搜,2017-01-17,最接地气的表情搜索！聊天斗图就用表情搜搜！,0.0
FIDE,0,9284,0%,金融理财,软件服务提供商小微数据化信贷解决方案,FIDE,2017-01-23,元宝铺FIDE是国内领先的小微数据化信贷解决方案，专注为银行等金融机构服务。目前已于浙商银行。泰隆银行等多家金融机构达成合作,0.0
一笔记账,0,9276,0%,工具计算器,记账理财生活消费清单记录,一笔记账,2017-01-23,一笔记账，最好用的记账小程序应用,0.0
gridplus,0,9223,0%,办公办公软件,项目管理任务管理移动考勤在线审批,gridplus,2017-02-05,格子加是一款解决企业内部协同办公的OA系统产品，支持项目管理、任务管理、移动考勤、在线审批、内部公告、日程管理、同事通讯录,0.0
留学资讯微报,0,9216,0%,教育学习,教育信息服务留学资讯,Zinch,2017-01-20,留学资讯精选，打算为大家用更好的体验呈现留学相关资讯，并且当资讯中关联了相关海外院校，大家可以直接查看院校相关信息。,0.0
头牌网,1,9173,100%,社交社区,投资创业,头牌网,2017-01-20,专门点评投资人的小程序，让你快速了解投资人的过往。,5.0
西瓜酒店预订,0,9103,0%,旅游酒店住宿,酒店预订周边搜索,西瓜酒店预订,2017-01-18,美团点评出品，酒店折扣优惠预订专家，无论情侣、家庭、度假或者商务出行，都能为您提供最具性价比的高品质多类型酒店预订服务。,0.0
芝麻二维码生成器,1,9001,100%,办公办公软件,二维码生成器社交工具,芝麻二维码生成器,2017-01-17,1. 方便解码，可以随时查看二维码的内容，扫码就可查看 特别功能：小程序带参数二维码解码功能，能查看小程序生成的参数二维码的内容 2. 生成二维码，网址，文字都支持 3. 分享可将生成的二维码分享给好友,5.0
K米点歌,4,8994,80%,音乐在线音乐,点歌预订KTV必备神器,K米神器,2017-01-24,全国KTV必备神器！点歌、预订、超市、会员卡一站式服务！KTV包厢直播互动，K歌新玩法，国内KTV聚会交友人气社区！,4.0
开眼视频Eyepetizer,0,8992,0%,视频在线视频,视频社交美食旅游,开眼视频Eyepetizer,2017-01-16,微信扫描上方开眼视频Eyepetizer二维码即可打开开眼视频Eyepetizer小程序，无需安装，如果喜欢请记得分享哦！,0.0
朝夕微课,0,8986,0%,教育学习,学习工具微课堂学习辅导,朝夕微课,2017-01-17,朝夕微课小程序是一款社会教育类型的小程序应用，朝夕微课小程序能够带给你各个方面的不同成长帮助，只要通过微信扫描朝夕微课小程序二维码就能进入朝夕微课小程序，在这里你可以随心订阅一些你喜欢的节目！,0.0
抢试用,1,8986,80%,母婴美妆,资讯美妆试用丽人,优美妆,2017-02-08,抢试用为用户提供优质商品的试用机会。用户通过试用报告分享体验，给商品做出公正的描述并帮助其他消费者做出购物决策。,4.0
砾石户外活动,0,8968,0%,旅游攻略,户外活动户外线路,砾石户外活动,2017-01-13,高品质户外线路、最炫户外玩法、深入秘境，让你感受与众不同的出行之路。砾石，带你玩出不同！,0.0
墨路通,0,8916,0%,出行交通,交通出行火车票酒店飞机票,墨路通,2017-01-16,墨路通提供基于用户位置的实时墨尔本地铁、电车与公交车班次信息。并在地图上显示用户周围的车站信息。,0.0
股票搜索,0,8909,0%,金融理财,资讯 投资 预测 股票搜索 大盘,信谁科技,2017-02-09,财经观点搜索引擎，从互联网平台、券商研报搜索财经预测观点，并提示观点可信度。,0.0
寓见公寓找好房,0,8893,0%,生活房产,租房找房,寓见公寓找好房,2017-01-20,提供自助找房、报修、保洁、投诉、支付房租等服务的平台,0.0
虎嗅精选,1,8820,80%,阅读资讯,新闻社交最新资讯,虎嗅精选,2017-01-16,聚合优质的创新信息与人群。 置顶虎嗅小程序，不错过互联网的每个重要时刻。,4.0
炉石传说小盒子,0,8797,0%,社交娱乐,游戏娱乐手游卡组资讯,炉石传说小盒子,2017-01-23,炉石传说天梯强势卡组展示与查询，可以分别按卡组强度和职业分类来进行快速查询。,0.0
地铁查询,0,8792,0%,出行交通,交通出行线路查询,地铁查询,2017-01-19,全国地铁查询，全国地铁线路查询，全国地铁站点查询,0.0
手机归属,1,8783,100%,工具查询,手机号查询属地查询,手机归属,2017-01-23,国内手机号码归属地查询。,5.0
节拍器Metronome,1,8779,100%,工具计算器,工具节拍器,芋篼,2017-02-05,简单好用的节拍器，可调节速度和节拍。,5.0
孕妈速查,0,8769,0%,母婴育儿,日常饮食信息查询,孕妈速查,2017-01-23,这个食物孕妈能不能吃？用孕妈速查，一查就知！,0.0
米考试在线,0,8769,0%,教育学习,交流平台英语学习四六级雅思托福考研,王晓锋,2017-02-10,米考试聚焦于四六级，考研，雅思，托福，SAT等专业考试领域，包括听力，词汇类，阅读类，作文类，口语类等移动考试应用。,0.0
远味云仓,0,8715,0%,生活美食,商城零食地方特产,远味云仓,2017-01-18,来着远方的味道。,0.0
美丽乡村平台,0,8699,0%,阅读资讯,信息服务互联网,美丽乡村平台,2017-02-06,“美丽乡村”为“线上县下”平台中的一个子栏目，为县域经济中的农村经济提供优质的互联网信息服务,0.0
大方游,0,8668,0%,旅游攻略,旅游线路旅游经验,大方游,2017-01-24,我爱旅游5a56.cn旗下产品，为广大用户提供优质旅游线路，分享旅游经验。,0.0
我的薪资,1,8636,100%,工具计算器,薪资计算公积金基数,Z.Z.K.,2017-02-08,我的薪资是薪资税务计算器。方便的为您计算个人税务和五险一金的缴纳情况，还有有趣的分享功能提供给您。,5.0
极速配,1,8613,100%,工具查询,宅配速配快递,路遥,2017-02-08,极速配专为物流信息部，配货站提供发布货源平台。,5.0
转运查查,0,8606,0%,工具查询,物流查询快递,转运查查,2017-01-17,海淘物流查询，支持全球100多家转运公司物流查询,0.0
作文精选,0,8603,0%,教育学习,作文,查字典-作文网,2017-02-05,作文精选囊括了小学作文、初中作文、高中作文、话题作文、历届中考，高考满分作文等，满足不同年级段的学生作文写作指导的需求。,0.0
二维码小帮手,0,8599,0%,办公办公软件,二维码生成器社交工具二维码名片,二维码小帮手,2017-01-23,解析二维码，二维码生成器，二维码名片生成器。,0.0
万达发布,0,8595,0%,阅读资讯,新闻视频最新资讯,万达发布,2017-01-18,大连万达集团股份有限公司微官网，提供万达集团最新资讯，视频等信息。,0.0
菜谱大全A,0,8564,0%,生活美食,菜谱美食,Anglep_7l6,2017-02-06,介绍常用的家常菜，经典菜及经典小吃的做法及营养成分。,0.0
上上铺+,0,8549,0%,生活房产,店铺转让店铺转租,上上铺+,2017-01-18,上上铺，专注城市商铺直连。房东、租户精准对接，隐私有保密，电话无骚扰。管家线下专业实勘，租户线上实景看铺。,0.0
淘豆京东自营旗舰店,0,8537,0%,生活美食,淘豆零食饮料商城,淘豆京东自营旗舰店,2017-01-20,淘豆是一家致力于互联网销售休闲食品零食品牌，淘豆京东自营旗舰店是淘豆品牌入驻京东的官方店铺，由京东发货配送，快捷高效。,0.0
嘻哈爆笑吧,0,8513,0%,社交社区,娱乐搞笑段子趣味阅读搞笑图片,嘻哈爆笑吧,2017-01-18,嘻嘻哈哈为您提供最新的经典笑话、搞笑图片、内涵笑话、冷笑话、脑残对话、动态图、搞笑段子、欢迎笑话爱好者加入爆笑生活社区。,0.0
菠萝PASS,0,8508,0%,购物商城,旅游餐饮美食服装,菠萝PASS,2017-02-01,"第一批先覆盖泰国普吉岛、清迈，更多城市逐渐开通。让你在海外用微信支付就可以吃的好、
喝得爽。更多优惠，就在海外 吃喝玩乐一卡通 “菠萝PASS""",0.0
南航e行,2,8507,100%,出行航班,交通出行火车票酒店飞机票,南航e行,2017-01-17,南航e行小程序一共拥有四个大功能模块，航班动态、航延证明、餐食预定以及我，旨在结合微信平台为广大客户提供一流的航班服务。,5.0
晚安计划,2,8501,100%,社交娱乐,晚安计划晚安睡觉睡不着失眠IT科技公益工具生活生活服务社交影音,午后科技有限公司,2017-04-26,每一声来自陌生人的晚安，伴你进入温柔良夜。,5.0
今日金价查询,0,8478,0%,金融理财,黄金金价金价查询今日金价查询黄金价格走势图,淘好翠,2017-02-06,"黄金,金价,金价查询,今日金价查询,黄金价格走势图,周大福今日金价,中国黄金今日价格,老凤祥今日黄金价格,六福珠宝今日金价,周生生今日金价,老庙黄金今日金价",0.0
上海小资美食地图,0,8445,0%,生活美食,美食推荐商城生活指南,上海小资美食地图,2017-01-17,上海小资生活第一站，盘点上海最新，最小资，最有情调的美食生活资讯。精选100+个热门标签，4000条魔都生活指南，今天去哪儿轻松get！,0.0
口袋表情包+,0,8440,0%,社交表情头像,表情包 微信,南京微沐软件科技,2017-02-08,选择示例场景动图，拍摄视频上传，2秒即可制作专属于自己的表情包！,0.0
e袋购,0,8438,0%,购物商城,护肤品商城购物攻略生活服务,e袋购,2017-01-16,e袋购APP是睿楠投资管理有限公司推出的为满足用户生活消费和线上购物需求的移动购物商城软件，购物类目涵盖服饰鞋包、美妆护肤、生活家居、家电数码、母婴用品等品类，提供优质的品牌商品和服务,0.0
粤通卡应用,0,8406,0%,工具查询,账单查询明细查询网点查询高速服务路桥收费,粤通卡应用,2017-01-24,提供粤通卡账单及通行明细查询，网点查询等功能。,0.0
农行微服务,0,8401,0%,金融理财,农行银行金融服务预约排队,农行微服务,2017-01-22,让您随时随地畅享农业银行便捷高效的网络金融服务,0.0
ZAKER广州,3,8394,94%,阅读资讯,新闻资讯图片信息发布平台,ZAKER广州,2017-02-08,ZAKER广州将全网的资讯和图片等富媒体内容，尤其是本地权威媒体生产的内容提供给本地用户，也是本地权威的，综合的信息发布平台。,4.7
多圈,0,8384,0%,生活美食,美食推荐美食点评,多圈,2017-02-01,美食=点评+推荐,0.0
积分入户测评,0,8363,0%,工具查询,计算工具买房必备房产信息信息查询,积分入户测评,2017-01-19,深圳积分入户测评，积分计算评测是否符合入户条件,0.0
程序秀,2,8335,80%,办公办公软件,互联网开发工具技术,咫尺网络,2017-02-10,程序秀能为小程序爱好者提供最新资讯，培训服务和最新案例，旨在让小程序开发爱好者们可以随时了解小程序开发的相关信息。,4.0
来者人事,0,8325,0%,办公办公软件,人力资源管理智能考勤审批薪资计算,来者人事,2017-01-24,来者人事，是先进的人力资源管理云平台，为企业提供智能考勤，审批，薪资计算等功能，开创全新无简历微招聘模式。,0.0
房之宝,0,8321,0%,阅读资讯,房产资讯楼市资讯,房之宝,2017-01-18,房之宝，网聚南京楼市最全资讯,0.0
求大夫鉴定,0,8286,0%,健康健康,医疗咨询医生在线就医指导,求大夫鉴定,2017-01-13,什么值得买？42万医生为你把关，还有医生集体推荐的健康产品。,0.0
绍兴E网招聘,0,8274,0%,办公办公软件,求职招聘绍兴招聘,绍兴E网招聘,2017-01-18,"绍兴E网招聘,绍兴本地招聘15年，绍兴人才，绍兴工作在这里。本地招聘很可靠。",0.0
AA账本,0,8260,0%,工具计算器,账本理财结算工具,资,2017-02-05,与家人朋友一起记账。满足家人、旅行、合租等大部分使用场景。简单高效的AA工具。智能结算方案，省时省心。,0.0
八字历书,0,8251,0%,工具日历,效率天气定日子万年历,八字历书,2017-01-13,八字历书为您提供祈福、纳财、嫁娶等吉日查询服务。以及每日宜忌、诸神方位灯信息，并编制出了具有特色的通胜模式日历，以便查看。,0.0
简单心理Uni+,0,8218,0%,健康健康,心理咨询健康,朱峰 Ben ????,2017-02-07,简单心理 Uni，为成长中的咨询师提供明晰的成长路径。,0.0
好猎手,0,8199,0%,购物商城,商城海淘购物攻略,好猎手,2017-01-19,"发现新奇特的创意产品,满足你对创意设计的好奇,感受最新的科技前沿,体现新鲜玩意。",0.0
创投圈那些事,0,8198,0%,社交社区,金融社交,创投圈那些事,2017-01-13,创投圈那点事，专注创投圈的业内一手资料。,0.0
ileven京东自营旗舰店,0,8179,0%,购物商城,ileven干货坚果零食,ileven京东自营旗舰店,2017-01-20,ileven不仅仅是一份零食，还是一种休闲方式。悦享生活，从”健康“开始，选择ileven，用营养来取悦味蕾，用美味来享受生活。,0.0
途虎养车Tuhu,7,8145,98%,购物商城,养车修车汽车工具及配件,刘昕 Jessica,2017-02-06,【轮胎】 精确适配的正品轮胎，输入车型自动适配，400城市万家门店免费安装。 【保养】 精准适配大小保养及车型，厂家正品机油。,4.9
种子时间,0,8137,0%,工具时钟,计算工具教育,种子时间,2017-01-13,「种子时间」- 放下手机，享受生活 我们希望帮助用户能够更加专注的去做一件事，而不被玩手机等不必要的因素干扰或打断,0.0
拇指快充,0,8126,0%,购物商城,电商商业服务生活服务,拇指快充,2017-01-16,提供手机话费和流量充值服务，为用户提供方便快捷的充值渠道。全网最低价！,0.0
医师法律问答,0,8119,0%,社交社区,法律服务律师法律咨询法律援助,医师法律问答,2017-01-18,通过提供法律问答服务，提高医师自我保护能力，倡导医师自律，改善医师职业环境。,0.0
一分钟评车,0,8100,0%,生活汽车,视频购车资讯语音,一分钟评车,2017-01-20,国内知名车评人YYP语音评车；新车试驾、车型评测、缺点揭露，点击一分钟评车马上收听吧！,0.0
表情包控,0,8095,0%,社交表情头像,二次元动漫欧美美剧英剧日剧韩剧表情表情包字幕台词番剧B站A站,歪歪,2017-02-13,动漫新番、欧美日韩剧集无水印表情包、字幕截图大搜罗,0.0
申万宏源新股日历,1,8094,100%,金融创投,投资股票股市动态,申万宏源新股日历,2017-02-09,申万宏源新股日历提供各种类新股动态，可申购、配号股票、中签股票、待上市等,5.0
豆瓣评分,1,8067,100%,阅读资讯,电影电视娱乐电影评分,豆瓣评分,2017-01-17,豆瓣评分小程序二维码是微信新版本推出的豆瓣评分小程序入口，豆瓣评分小程序提供电影查询与评分公示，抛弃其他多余的功能，专注做一个电影评分展示工具。,5.0
袖扣VR,0,8061,0%,阅读资讯,新闻资讯测评VR眼睛,袖扣VR,2017-01-24,关于VR眼睛的品牌、新闻、测评、教程、专题等资讯了解，让用户最快的了解和使用VR眼镜，VR眼睛商品的相关资讯、参数、图片的预览,0.0
喵姐育儿问答,0,8054,0%,教育儿童教育,育儿早教,喵姐育儿问答,2017-01-16,北师大学前教育硕士，著名早教专家高寿岩，用26年早教专业经验，帮助0-6岁宝宝早期教育、性格养成。家庭教育的技巧和靠谱知识都在这里！,0.0
孩教圈故事,0,8040,0%,阅读听书,有声读物幼儿音乐故事绘本,孩教圈,2017-01-23,孩教圈故事，0-12岁孩子的故事机，睡前故事、绘本故事、名著故事等上百种故事，还能创作自己的故事，更有儿歌、动画、知识等内容，给孩子一个有故事的童年,0.0
厕所在哪,1,8032,100%,工具查询,生活服务公益,Answer,2017-02-07,内急怎么办?通勤助手微你快速找到附近的厕所!舒坦!,5.0
跑步训练,0,8023,0%,健康运动,跑步健身,赵东|赵知了,2017-02-13,"跑步训练是一个面向热爱跑步人群的小程序。如果你喜欢远距离跑，那最适合不过了！
在这里你可以获得来自国内马拉松冠军制定的科学训练方案。
按照科学的方案进行训练，不仅能够提高你的跑步能力和成绩水平，还能够让你在提高过程中避免受伤，快乐奔跑。",0.0
瓯柑新闻,0,8023,0%,阅读资讯,瓯柑新闻最新资讯新闻温州晚报,瓯柑新闻,2017-02-01,温州日报报业集团旗下温州晚报官方小程序，为用户滚动发布温州资讯和温州人关注的资讯。,0.0
艺龙酒店预订,3,8019,100%,旅游酒店住宿,生活服务旅游酒店住宿,艺龙网信息技术（北京）有限公司,2017-01-20,"艺龙旅行网为消费者提供全球200多个国家75万家酒店住宿及机票、火车票等预定服务；是中国在线和移动住宿服务提供商,致力于打造专注专业、物超所值、智能便捷的住宿预订平台,通过艺龙客户端、PC网站、24小时预订热线（4009-333-333）,更多详情请登录艺龙官网www.elong.com!",5.0
木材材积计算,0,8008,0%,工具计算器,计算器工具,木材材积计算,2017-02-06,木材材积计算器根据国家标准GB4814-84《原木材积表》、GB4815-84《杉原条材积表》设计而成，计算快捷、数据准确。,0.0
日历黄历万年历,0,8003,0%,工具日历,效率天气定日子万年历,日历黄历万年历,2017-01-13,最简洁最好用最方便的随身日历,0.0
踢球,2,7980,80%,体育足球,足球足球比赛运动,lotta,2017-02-07,专为广大足球爱好者打造，在微信群里发起足球比赛报名，后期版本会支持管理球队、出勤统计,4.0
好大夫+,3,7978,100%,健康健康,医疗咨询医生在线就医指导,好大夫+,2017-01-23,好大夫收录50万全国医生，您可根据医院、科室、疾病、地区等维度快速找医生，查看医生简介、出停诊时间地点、专家擅长、患者评价,5.0
LeanTodo,0,7967,0%,工具日历,工作备忘录生活备忘录,LeanTodo,2017-01-24,使用LeanCloud存储SDK实现的LeanTodo应用。,0.0
玲珑快闪店,1,7931,80%,社交社区,测评电商商家自营技能传授,玲珑快闪店,2017-02-08,线上快闪店，实时围观达人传授技能、评测好物、发现属于自己的单品。不定期开铺，等你来玩。,4.0
湖北两会,1,7859,40%,阅读,资讯政治时事,湖北两会,2017-02-07,2017年湖北两会湖北日报专题报道,2.0
钓鱼天气,0,7854,0%,工具天气,钓鱼天气钓鱼指数,钓鱼天气,2017-01-24,钓鱼人天气助手，每天查看钓鱼天气，钓鱼指数,0.0
澳猫购物,0,7854,0%,购物商城,海淘商城澳洲正品,澳猫购物,2017-02-13,澳猫购物――澳洲正品购物,0.0
家居e管家,1,7826,80%,生活家装,装修案例家装建材,搜狐焦点家居,2017-02-07,家居e管家聚集了家居设计领域的装修公司，工长以及设计师，包含大量的装修案例，装修日志，设计作品以及家居美图等。,4.0
深圳航空小助手,1,7812,100%,出行航班,航空航班值机,深圳航空,2017-02-06,深圳航空小助手，关心您的每一次出行体验。为您提供最搞笑的选座值机方案，随后，您将体验预订机票，航班动态。,5.0
小记一笔,5,7805,96%,金融理财,收入开支记帐开销,李金云,2017-02-08,随时随地记录收支情况，方便、快捷的记帐神器。,4.8
珠海报业,3,7789,100%,阅读资讯,新闻最新资讯图片旅游线路,珠海报业,2017-01-18,服务珠海，关注珠海，为大家提供最新的珠海资讯！,5.0
广州交警违法举报,0,7785,0%,出行交通,工具交通生活服务,广州交警违法举报,2017-02-05,广州交警e会员可以对广州市行政区域内发生的交通违法行为进行现场举报。,0.0
淮扬巷子,0,7784,0%,阅读资讯,自媒体平台自媒体,扬州易人科技文化传播有限公司,2017-02-08,淮扬巷子”是一款基于微信小程序研发出的新型本土化综合平台。 它为用户推荐有价值的、个性化的信息，您可将身边正在发生的、好玩的、及时的资讯发布到“淮扬巷子”。它为自媒体人与粉丝搭建线上实时互动，线下交流探讨的桥梁。 “淮扬巷子”区别于其他平台，只要你发布咨询，就能让更多的家乡人认识你，了解你，你身边的亲朋好友都是你的粉丝，更利于个人，企业的宣传。 它可以根据用户的阅读习惯，自动识别精彩内容，精准推荐给您，让您的生活更美好！,0.0
祝福话,1,7770,100%,社交社区,祝福工具节日祝福语春节祝福语,祝福话,2017-02-01,元宵节、情人节即将来到，绞尽脑汁不知该怎么跟TA打招呼，祝福话小程序来帮忙，精美主题贺卡，精选趣味祝福话，给TA一份惊喜，让你的问候与众不同！,5.0
飞蚂蚁英语对话机器人,0,7753,0%,教育单词字典,学习工具英语单词速记,飞蚂蚁英语对话机器人,2017-01-17,飞蚂蚁英语对话机器人小程序帮助你打破不敢说英语的尴尬境地、帮助你提高英语对话能力；机器人会自动用语音以及文字和你对话，在你无聊的时候用来学习英语的好帮手！快来尝试吧！,0.0
百家视角,0,7717,0%,阅读资讯,最新资讯新闻最新科技信息最新体育资讯,百家视角,2017-02-05,"最新科技信息,最新体育资讯，最新娱乐动态",0.0
今年多大,0,7663,0%,工具计算器,年龄计算工具休闲,王辉,2017-02-09,今年多大了？？赶紧查查吧！,0.0
sdkcn+,0,7628,0%,社交社区,技术资讯文章阅读,sdkcn+,2017-01-17,第一个为开发者量身定制的小程序，最新的技术资讯文章，开发工具一手掌握！,0.0
西有小助手,0,7627,0%,购物商城,商城海淘,西有小助手,2017-01-17,"西有小助手小程序经营的都是正宗国际海外店：
　　全球买手店直购，百分百正品保障！
　　全程海关监督，购物流程安全透明！
　　海外商品同时、同款、同价、零时折差价！
　　轻松退换、无忧海购、５-１０天闪电到货！
　　西有小助手保证７天无理由退货！",0.0
99广场舞视频,2,7615,90%,视频在线视频,广场舞视频广场舞教学,99广场舞视频,2017-01-24,热门广场舞视频在线观看，高清视频教学。拥有丰富的网络流行舞曲下载，众多广场舞名师资源。,4.5
广西壮族自治区人民医院掌上医院,0,7609,0%,健康健康,医疗预约挂号检查检验报告查询,广西壮族自治区人民医院掌上医院,2017-02-10,广西区人民医院小程序提供绑定诊疗卡、预约挂号、排队查询、检查检验报告查询、住院押金补缴及费用清单查询等就诊全流程服务。,0.0
图书馆+,0,7584,0%,教育学习,图书馆教育 高校 支付宝 图书馆,鸟窝科技,2017-02-08,整合全国图书馆的检索数据，跟支付宝-校园生活-图书馆，各大高校微信图书馆  数据同步,0.0
三生三世十里桃花TV,1,7483,100%,视频在线视频,电视腾讯视频三生三世十里桃花,三生三世十里桃花TV,2017-02-06,腾讯视频《三生三世十里桃花》特别版,5.0
财经日历VIP,0,7462,0%,金融创投,财经资讯日历数据投资理财,财经日历VIP,2017-02-05,财经日历VIP是一款投资理财小程序应用，财经日历VIP小程序每天都会为投资的朋友带来最新的数据消息，帮助大家在投资的时候能够更有把握的面对数据，特别是那些做现货、外汇的一些朋友们，非常的有用，不要错过哦！,0.0
新华社微悦读,3,7456,100%,阅读资讯,新闻媒体,新华通讯社,2017-02-07,"无需下载、触手可及，小而精、优而简，“新华社微悦读”今天上线啦！据腾讯介绍，新华社微悦读是第一个上线的新闻类微信小程序。

新华社微悦读是新华社在微信小程序的名称，依托新华社遍及全球的庞大新闻信息采集网及强大内容优势，结合微信小程序的轻量化、无需安装、用后即走等特点，用更便捷的传播方式为你开启全新的新闻阅读模式。

新华社微悦读设有首页、现场、图视、记者等栏目，精选的新华社新闻更加适合微传播的特点。",5.0
简单心理课堂,0,7449,0%,教育儿童教育,学习工具微课堂学习辅导心理课程,简单心理课堂,2017-01-17,"简单心理课堂小程序有用吗？
　　在简单心理课堂小程序，有许多有名的心理老师在线为你服务，还为你准备了一些过往的讲课教程，教你如何在真正需要说“不”的时候不说“好”。
　　人生在于不断的突破自己、挑战自己，在关键的时候心理承受能力是关键，有时候需要一些心理上的指导来让你摆脱困境，在简单心理课堂小程序你只要敞开心扉就能得到豁然！来吧，创造更美好的你！",0.0
猎摩,0,7444,0%,工具查询,查看附近车辆信息打击违章停车查看停留时间,猎摩,2017-01-23,摩拜查询工具，实时查看附近的车辆信息（车号，停留时间等），方便摩拜猎人挑选目标打击违章停车。,0.0
