小程序名称,评价人数,人气,好评率,分类,标签,作者,发布时间,小程序介绍,评分
摩拜单车,17,977582,90%,出行交通,交通出行火车票酒店飞机票,摩拜单车,2017-01-11,扫码即可骑走的共享单车,4.5
她厨美食,19,447498,98%,生活美食,世界美食中国美食知名美食流行美食外国美食美食天下食谱大全家常食谱菜谱食谱,考拉网络,2017-04-07,源自意大利COOK FUN的原生理念开发，专注于世界美食的分享制作。由国际资深美厨家推送，易学的步骤、干净的画面、精美的拍摄、清晰的制作流程。让每一个人的厨房都充满艺术范，舌尖上的世界，谱写属于你的美厨范！,4.9
糗事秀,14,398650,84%,社交社区,搞笑段子趣味阅读表情社交,糗事秀,2017-01-19,每天分享有趣的图文信息，笑话锦集，让您的生活每天多姿多彩，爆笑连连,4.2
网易漫画,8,291961,100%,阅读漫画,卡通在线漫画,网易漫画,2017-02-14,网易漫画，有态度的看漫画神器，精品国漫日漫免费看！独家签约国内漫画大神。,5.0
一家民宿+,4,281619,76%,旅游酒店住宿,民宿酒店住宿日租房自由行民宿,一家民宿,2017-01-28,全球华人民宿信息平台，出境游旅行必备。专注华人一站式旅行，轻松跨越语言障碍。站内查看完相关房源信息。,3.8
汽车之家+,14,238965,92%,生活汽车,汽车资讯汽车报价汽车新闻,小目标,2017-01-23,"汽车之家为您提供最精彩的汽车新闻、评测、报价、图片、视频,最真实的用户买车、用车感受文章，是全球访问量最大的汽车网站。",4.6
轻松同传,3,204639,74%,教育单词字典,智能翻译词典彩云翻译中英互译英文阅读英文学习口语学习有道词典金山词霸百度词典,智能翻译,2017-02-15,致力于人工智能的语音翻译服务，让语言转化更方便、更好玩。通过文字或者语音的方式直接翻译，且地道口语化。学习、出国旅游必备神器。是英文翻译、英文词典、有道词典、金山词霸等基础软件的升级产品。,3.7
QQ阅读,10,183641,94%,阅读电子书,,QQ阅读,2017-01-12,"【全网独家】热播剧《放弃我，抓紧我》（陈乔恩王凯主演的电视剧）,《心理罪》,《法医秦明》,《美人为馅》，《如果蜗牛有爱情》原著尽在QQ阅读

【更多热书】《诛仙》：网文大神萧鼎巨著，看烧火棍少年的佛道双修！《麻雀》：李易峰主演谍战剧原著，民国谍战小说新巅峰！
《微微一笑很倾城》：校园王子+游戏高手肖奈网上网下全方位捕猎美人心攻略...

【个性推荐】精选信息流推荐理由告诉你，私人定制不忽悠； 

【游戏中心】文游联动，热门小说改编游戏，等你来玩
更多贴心服务等你发现；

【云书架】书籍、阅读进、笔记，关联帐号，自动云同步；

【发现好书】今日免费，查看免费好书；包月专区，只看包月书籍；找书神器，自定义条件，随心查找~~ 

【名家齐聚】大神携名作汇聚名人堂，快来找找你心水的作家！ 

【实惠签到】每日签到领好礼，签满7天，周日还能抽大奖！ 

【精致排版】优化排版体验，图文并茂，打造优秀阅读体验~~

【阅读时长】看看你的阅读时长可以打败多少人，更有惊喜等着你哦",4.7
名画滤镜APP,0,165155,0%,图像美化滤镜,美图学习社交,聚类科技,2017-01-07,名画滤镜APP第一时间推出微信小程序版本啦！想把照片变成像梵高《星空》那样的艺术作品吗？无需安装APP，名画滤镜小程序就可以帮到你。名画滤镜小程序是一款基于人工智能的P图利器，轻松把你的照片变成世界名画风格，艺术感爆棚，其移动APP版本更入选爱范儿MindStore周榜，快来试试名画滤镜，体验一下梵高怎样“画”出你的照片，此外还有莫奈《日出印象》、蒙克《尖叫》以及水彩、素描、彩色玻璃、蜡笔等多种名画艺术风格可供选择，让我们与艺术大师们汇聚一堂，聆听、体验他们的艺术大手笔！,0.0
阅读新发现,23,133042,92%,阅读资讯,阅读资讯生活科技,yanyezzzzz,2017-02-05,健康生活新阅读，提供各类饮食知识养生资讯，传递健康创建科学科学生活观。,4.6
随身养,5,101540,96%,健康健康,健康管理养生资讯社交,随身养,2017-01-23,一个崇尚科学养生的内容与交流平台,4.8
极简笔记,22,99187,100%,办公存储,笔记日记公办工具,Q,2017-02-08,随时随地，即用即走，快速记录，同步笔记,5.0
洽总日签,11,87769,92%,工具日历,日历签到,上海洽客网络科技有限公司,2017-03-06,洽总日签是一款玩法多样、内容丰富的签到应用，由高逼格城市生活方式的倡导者、社群精神领袖 #洽总 #(公众号：checkinboss) 创建。,4.6
豆当专业搬家公司,0,87174,0%,生活家政服务,搬家公司面包车出租货车出租,徐州豆当网络科技,2017-01-16,豆当搬家是专业的搬家公司，在这里可以查询提供搬家的车型和报价,0.0
热点小黄历,20,80461,96%,工具日历,运营热点营销热点公关,深圳道乐科技有限公司,2017-02-24,全年400+营销活动公关热点大全，借势营销节点随时查，运营公关的必备宝典。,4.8
忆年共享相册,10,80131,90%,图像美化滤镜,纪念相册网络相册DIY相册,忆年,2017-01-09,"忆年共享空间，让小圈子共享照片更方便。为亲密小圈子提供快速交换和共享照片的服务，让我们的照片在一起。
照片只有进入空间的小伙伴才能看到，并且云端永久储存在专属于你们的私密小空间。忆年想用一个个小而美的私密空间，为你记录所有值得分享的时刻。",4.5
闪电健身Mini,11,75394,100%,健康运动,闪电健身减肥瘦身,Seven,2017-01-09,适合你的锻炼才会有效果。闪电健身，你不用成为专家，一样可以练出好身材。,5.0
妙汇商店,0,74081,0%,购物商城,商城生活服务护肤用品,妙汇,2017-01-05,发现创意，乐享生活；个性化购物与创意生活指南。提供高品质的产品，注重时尚与性价比，强调设计感与品位。正品保障，全场包邮。,0.0
乐学速算,2,73735,100%,教育学习,口算速算心算,南京微加倍信息科技有限公司,2017-01-31,通过自主练习和好友PK，快速提升低年级小学生的口算、心算和速算能力。,5.0
腾讯视频,15,70239,94%,视频在线视频,影视电影娱乐视频,腾讯视频,2017-01-12,众多顶级内容独家揽入，HBO独家官方授权播放平台，腾讯视频与你一起迎接崭新的2017！,4.7
滴滴出行DIDI,7,66100,94%,出行交通,交通出行生活服务,Joe_志文,2017-01-10,滴滴一下，随叫随到。滴滴出行小程序版，迅速，快捷。,4.7
小新任务,3,65014,94%,办公办公软件,便捷高效沟通轻松办公,天津市瑟威斯科技有限公司,2017-01-20,任务分配的好助手。你可以通过小新任务，创建你自己的团队，邀请团队成员，发布任务，指定执行人，高效协作完成任务,4.7
王者荣耀官网,3,64045,94%,阅读资讯,王者荣耀腾讯游戏娱乐手游,王者荣耀官网,2017-01-12,《王者荣耀》是全球首款5V5英雄公平对战手游，腾讯最新MOBA手游大作！5V5王者峡谷、5V5深渊大乱斗、以及3V3、1V1等多样模式一键体验，热血竞技尽享快感！海量英雄随心选择，精妙配合默契作战！10秒实时跨区匹配，与好友组队登顶最强王者！操作简单易上手，一血、五杀、超神，极致还原经典体验！实力操作公平对战，回归MOBA初心！,4.7
京东购物,9,61391,96%,购物商城,京东商城生活服务,京东购物,2017-01-12,"-----多快好省，只为品质生活-----
1. 新人大礼：新人专享188元大礼包
2. 专享特权：每日多款商品享受手机专享价
3. 正品行货：100％正品行货、全国联保
4. 闪电到货：211限时达、次日达、极速达、夜间配",4.8
毒舌电影社区,11,57892,90%,视频在线视频,最新资讯电影社交,毒舌电影,2017-01-08,集影片推荐、影片信息查询和深度影评于一体的影片资讯小程序。想知道有哪些新电影资源，想知道有什么好电影，毒舌电影满足您。,4.5
探城美食APP,4,54222,100%,生活美食,社交美食推荐周边搜索,香灰,2017-01-07,探城是专注于发现与分享的精品美食社区，一款吃货必备的优质美食探店神器，每日精选探文推荐同城美味好餐厅，已开通全国11个热门城市。,5.0
美团外卖+,10,52505,96%,生活美食,生活服务商城美食周边搜索,美团外卖+,2017-01-12,美团外卖，目前国内最大的外卖网上订餐平台。美团外卖提供北京，上海，杭州，广州，天津等全国300城市网上订餐，附近的外卖送餐，药品，网上超市百货，水果外卖，上美团外卖官网。,4.8
买一只+,0,52274,0%,购物商城,养宠顾问宠物商店,charlie,2017-01-09,放心买宠物，就找『买1只』（1）卖家认证（2）担保交易（3）30天保障（4）健康保险（5）分期付款（6）大礼包（7)养宠顾问,0.0
去哪儿机票火车票汽车票,8,52097,98%,出行交通,交通出行火车票飞机票,去哪儿出行,2017-01-12,光速抢票，极速出票，免登录，可预约,4.9
爱奇艺视频,8,50898,90%,视频在线视频,爱奇艺视频电视电影,爱奇艺视频,2017-01-24,爱奇艺视频小程序为用户提供了正版、高清的热门电视剧资源，《射雕英雄传》、《美人为馅3》、《无间道》等海量剧集等你来看！,4.5
购物决策助手,0,50383,0%,购物商城,护肤品商城购物攻略生活服务,什么值得买,2017-01-09,购物遇到困难无法抉择？试试购物决策助手吧，专家意见结合用户需求，最适合你的商品，就要这么选！（什么值得买smzdm.com出品）,0.0
孕期提醒APP,4,49271,100%,母婴育儿,育儿女性健康,孕期提醒APP,2017-01-04,孕期实用工具，胎宝宝发育和准妈妈自身变化；产检计划、孕期体重管理计划和饮食计划；预产期计算、胎教音乐、症状解读等小工具。,5.0
腾讯网,6,49267,100%,阅读资讯,新闻视频最新资讯,腾讯网,2017-01-20,24小时全方位资讯，更新你的每一天,5.0
饿了么外卖服务,7,48669,98%,生活美食,外卖点餐,上海拉扎斯信息科技有限公司,2017-01-10,饿了就用饿了么！小程序版，更方便，微信也能点外卖。,4.9
亿云便利店,2,45838,100%,购物商城,超市便利店商城,亿云店铺,2017-01-24,便利店超市专用,5.0
喊话,10,45519,100%,社交社区,打赏广告发布市场调查,123,2017-02-15,喊话是一个低成本的广告发布平台，广告投入金额以打赏方式赠送给观看用户。,5.0
IT查报价,1,45142,100%,工具查询,电商商业服务生活服务,IT查报价,2017-01-13,每月科技新品预告，用最直观的方式解读数码产品，帮助您快速掌握数码新品介绍和全网报价。此外，我们还提供最客观，中立的产品口碑评分排行，看排行再消费，更快更优的选择产品。,5.0
小小包麻麻好物,17,44040,98%,母婴育儿,育儿辅食添加幼儿疾病护理母婴用品评测,dada,2017-01-09,300万父母关注！正确辅食添加，幼儿疾病护理，母婴用品评测，0-4岁前沿育儿知识全在这里！,4.9
亿欧plus,0,43276,0%,阅读资讯,新闻最新资讯,亿欧plus,2017-01-18,专注于新科技、新理念与产业结合的内容平台，是互联网创业者和产业创新者的首选学习平台。,0.0
观智科技,2,42868,100%,社交社区,小程序开发网站建设网页设计,百乐,2017-01-17,"一群热爱技术、设计、营销、运营的互联网技术团队，我们在互联网行业工作9年，
从初入江湖到对项目的身经百战，最早是为中小企业做网站和各种门户站，以电商平台的建设，
目前到移动网页的开发，和微信网站的开发，H5页面制作到最新的小程序开发。",5.0
记账e,2,42616,90%,金融理财,投资理财金融,邓仔,2017-01-06,日常收支记账，花销、开支分类记录，理财小帮手,4.5
易塑网+,1,41915,100%,购物商城,塑化电商塑料原料改性塑料,易塑网（186086.com）,2017-02-17,买卖塑料，上易塑网,5.0
本地天气,1,41484,100%,工具天气,天气工具生活,坚果科技,2017-01-16,本地实时天气预报查询,5.0
亲戚关系,7,41091,100%,工具计算器,计算工具生活服务,六坤,2017-01-09,亲戚关系是一款最全面的中国亲戚关系计算器，走亲访友，逢年过节必备神器，避免叫错、不会叫亲戚的尴尬，人人必备亲戚关系工具。,5.0
小睡眠,10,40676,100%,工具时钟,健康生活服务,心潮科技,2017-01-08,心潮小睡眠是一款睡前辅助小程序，数十种最纯粹的天然白噪音，帮你阻挡世界的嘈杂，营造完美氛围。今夜拥有小睡眠，梦里细雨微风、落叶飞雪…,5.0
健康汇lite,4,39958,100%,健康健康,健康资讯视频,健康汇lite,2017-01-19,提供有价值的健康资讯、精选高质量的健康短视频，健康汇APP-小程序。,5.0
生理节律,0,39762,0%,健康健康,工具生理节律人体节律信息查询,生理节律,2017-01-19,提供专业的生理节律（人体节律）查询功能。,0.0
荔枝FM播客,5,39134,96%,音乐在线音乐,,lizhiapp,2016-12-27,荔枝FM，人人都是播客，最具原创活力的播客平台。通过荔枝FM小程序，可随时随地收听声音电台直播。,4.8
最美贺卡,9,38722,98%,社交社区,祝福贺卡新年贺卡音乐贺卡,最美贺卡,2017-01-19,新年必备的微信小程序，让拜年变得简单而有创意,4.9
大众点评+,7,38267,98%,购物商城,美食分享电影休闲娱乐,大众点评+,2017-01-12,吃喝玩乐，尽在大众点评。,4.9
碎乐＋,8,38123,96%,音乐在线音乐,资讯音乐语音,碎乐,2017-01-20,乐坛天王天后、音乐大咖、创作奇才齐聚碎乐！ 汪峰、李健、邓紫棋、薛之谦、谭维维、赵雷、常石磊、李志等音乐大咖带你玩赚音乐，创造不一样的音乐新元素，聆听中国好声音！ 碎乐，全新的音乐品类. 来碎乐，与音乐大咖及原创作者近距离玩音乐. 来碎乐，每个人都可以成为音乐的创作者，获得赞赏，得到收入. 在这碎片化的时代 已没有磁带唱片 音乐也不再是歌单 点滴碎片的音乐 才是音乐娱乐本性的回归 在碎乐 天王天后明星 酒吧地铁DJ 亦或居家写字楼喜欢音乐的你 随时随地用音乐表达生活 倾听、目睹不一样的音乐 你可以 在有感的时间轴上 用弹幕留下自己的存在 也可以 用礼物表达对音乐的喜爱 喜欢某个音乐人 只需一句提问 换回磁性或者温婉的真声答复 在碎乐 每个人都是音乐的创作者 每个人都可以 在最近的距离 感受音乐 感受音乐人的温度 在碎乐 我们一起玩音乐,4.8
德州扑克工具,0,37635,0%,工具计算器,金融生活服务社交,德州扑克工具,2017-01-13,中国最大的德州扑克工具平台。包括 ①盈亏记录 ②胜率计算 ③保险计算 ④德州财神 ⑤活动神器。更多工具持续更新中。,0.0
百道搜书神器,1,37548,100%,阅读电子书,信息查询搜书工具,bookdao,2017-01-20,信息查询，搜索书籍，杂志,5.0
音乐站,9,37289,100%,音乐在线音乐,音乐朋友圈音乐,腾讯,2017-05-20,音乐旅途，和他们一起听歌,5.0
天气e,3,37206,100%,工具天气,生活服务旅游效率,邓仔,2017-01-06,天气信息查询，未来15日内气象、温度、PM2.5等信息查询,5.0
道客阅读,0,37192,0%,阅读电子书,文档阅读信息咨询在线教育,道客阅读,2017-01-20,道客阅读是道客巴巴官方推出的小程序，致力于更优质的文档阅读体验，可以轻松搜索阅读道客巴巴网站的全部文档.,0.0
二手车e,2,37150,100%,生活汽车,二手车信息资讯评估在线查询,邓仔,2017-01-06,二手车信息、资讯、评估、在线查询服务,5.0
美文日历,0,37122,0%,工具日历,日历天气效率美文,美文日历,2017-01-19,美文日历，每天一句美文，伴随你一生。,0.0
亲友相册,2,36304,100%,图像美化滤镜,相册图像美化滤镜工具,ppgo,2017-01-20,好时光，齐分享 -- 亲友相册。 通过你最美的照片，跟亲友一起，分享每一个瞬间。,5.0
爱弹唱,11,36008,98%,音乐在线音乐,吉他教学学习音乐,爱弹唱,2016-12-28,爱弹唱 吉他曲谱 尤克里里曲谱 吉他教学 尤克里里教学 吉他 尤克里里,4.9
单位换算器,0,35678,0%,工具计算器,单位换算办公效率教育,福熊网络,2017-01-17,单位换算器 - 帮您精准换算各种计量单位，是您学习、工作、生活的好帮手。例如：一罐330ml可乐含有热量594千焦(kJ)=141.9066大卡(kcal),0.0
同程火车出行,1,34596,100%,出行交通,交通出行火车票酒店飞机票,同程火车出行,2017-01-13,支持查询预订高铁、动车、火车票；,5.0
决胜前端,12,32836,96%,教育学习,简历制作简历投递人事面试技术面试入职与工作,HTML5学堂（码匠）,2017-02-06,为您解决“简历制作、投递、人事面试、技术面试、入职与工作”中的疑问，分享职场相关知识和感悟，让我们一起决胜前端！―码匠,4.8
番茄闹钟,2,32053,100%,工具时钟,生活备忘录,小朝,2017-01-10,微信上就能用的番茄闹钟，让你保持专注每个25分钟！,5.0
赶集找工作,3,31967,100%,办公办公软件,求职招聘找工作,赶集找工作,2017-01-13,找工作，找人才就在赶集网！,5.0
汇率e,1,30418,100%,工具计算器,金融投资理财汇率查询,邓仔,2017-01-06,汇率查询及相关服务,5.0
情侣相册,2,30404,100%,图像美化滤镜,纪念相册网络相册DIY相册视频,恋爱记,2017-01-10,和恋人共同管理你们的照片和视频。两人共用的私密空间，照片视频轻松上传云端存储。,5.0
孕妈能不能吃,1,30030,100%,母婴育儿,育儿美食养生生活服务,孕妈能不能吃,2017-01-17,孕妈能不能吃，是一款针对女性在孕期，月子，哺乳期间及宝宝辅食的饮食禁忌指南。,5.0
轻芒杂志,14,29955,96%,阅读杂志,时尚资讯阅读社交学习,inneruniverse_,2016-12-28,"每个人都有兴趣，如果没有，就该培养一个。

超过 160 本精选兴趣杂志：涵盖家居、美食、护肤、艺文、宠物、运动、科技、旅行、手工等所有生活领域。从入门知识，到好物、配方和去处，每天更新适读好文章。还可以把你的兴趣告诉小花，它就能帮你定制一本自己的杂志。

简洁优美的笔记：在文章中发现别人留下的笔记、划下的重点，在分享的过程中发现更多乐趣。而只要轻松长按一段话或一张图，就可以方便添加你自己的笔记和摘录。

低密度排版：给生活足够的留白，希望你能每天轻松愉悦地打开。",4.8
猫眼电影,5,29623,100%,生活票务,电影票电影资讯,Joe_志文,2017-01-10,一如既往为大家提供电影购票福利,5.0
科技日历,1,29441,100%,阅读资讯,日历咨询,Felix,2017-01-09,中关村在线出品，便于用户查询科技行业将来及过往新品发布会、行业展会、高端访谈信息，浏览最新科技资讯，翻看趣味科技老黄历。,5.0
易菜谱,2,28826,100%,生活美食,菜谱提升厨艺美食推荐,易菜谱,2017-01-13,指尖上的美食菜谱，为各位美食爱好量身定制的微信小程序。,5.0
腾讯加油卡服务,2,27712,100%,工具查询,加油卡充值余额查询,PrinCe,2017-01-09,提供括中石化、中石油、中海油等加油卡充值服务、余额查询等服务。,5.0
小故事Pro,1,27123,80%,阅读听书,有声读物睡前故事性格养成,小故事Pro,2017-01-17,小故事，篇幅短小，故事情节简单而又富于哲理的故事,4.0
鹿吃青年,7,26712,98%,生活美食,工具生活美食,糖小面儿,2017-04-25,山中有树树下有鹿，你来我往，你走我藏！,4.9
狐秀,0,26666,0%,阅读资讯,文章视频笑话漫画,狐秀,2017-01-17,狐秀是一个轻杂志应用，每天放送有趣的文章、图片以及视频。,0.0
美家帮互联网装修,0,26521,0%,生活家装,房贷计算买房必备房产信息装修顾问,丁玲lynn,2017-01-09,美家帮是互联网家装第一股（股票代码836509）。主打精装777元/O、十大一线品牌、APP在线监工、40天科学工期，让装修从此透明！,0.0
青蜻蜓,3,25831,74%,音乐在线音乐,搞笑段子媒体广告趣味阅读趣味聊天,QingTing.FM,2017-01-09,"听广播电台，有声小说，相声小品，新闻，音乐，脱口秀，历史，军事就用蜻蜓FM！
你想听的我们都有，两亿用户都在用！",3.7
今日头条lite,2,25803,80%,阅读资讯,新闻社交音乐视频,今日头条lite,2017-01-11,“今日头条”是一款基于数据挖掘技术的个性化推荐引擎产品，它为用户推荐有价值的、个性化的信息，提供连接人与信息的新型服务。,4.0
值得买京东优选,1,25567,80%,购物商城,护肤品3C数码购物攻略,什么值得买,2017-01-09,"什么值得买京东优选:推荐京东商城最值得买的商品。
1.优选:值得买小编精心挑选最值商品
2.发现:更多值友爆料商品，还能分类筛选",4.0
形色识花,7,25431,94%,工具查询,工具信息查询,形色识花+,2017-01-19,『形色识花+』是由『形色App』出品的识花小程序。只需1秒就能知道植物的名字和寓意，探索大自然的奥秘。,4.7
金牌房贷计算器,0,25244,0%,工具计算器,计算工具买房必备房产信息装修顾问,金牌房贷计算器,2017-01-17,金牌房贷计算器专为金牌房产销售的您！全面支持公积金贷款，商业贷款，组合贷款让您轻松应对客户，创造销售神话！,0.0
腾讯翻译,0,24859,0%,工具查询,腾讯翻译英语,腾讯,2017-01-21,腾讯翻译是腾讯出品的一款可进行多国翻译软件。软件可实现各国语言实时在线翻译，让用户口语学习与出国再无语言障碍，手机轻松进行翻译，喜欢的用户欢迎下载使用。,0.0
图文神器,1,24758,100%,社交社区,,图文神器,2017-01-12,首个小程序长图文发布工具，可以用来写游记，日记，还可以生成文章快照保存分享到朋友圈。,5.0
熊猫记账,2,24648,100%,工具计算器,精准报表记账理财房贷计算器,熊猫记账,2017-02-05,熊猫记账小程序是熊猫金库旗下的记账应用，专注为您提供最方便快捷的记账服务；精准报表帮您分析收支状况，每天只需3秒养成理财好习惯。,5.0
肯德基+,3,24483,100%,生活美食,生活美食,肯德基+,2017-04-01,肯德基手机自助点餐，随时随地，点餐不排队！还能享受惊喜优惠，积累K金，兑换缤纷好礼！,5.0
技能街名录,4,24330,100%,社交社区,,技能街名录,2017-01-11,"技能街名录 是一个技能共享平台。
在这里，你可以了解更多技能人、技能，学习或交换你喜欢的技能。
技能街，让你我更有价值。",5.0
旅行翻译,2,23852,90%,工具查询,教育在线翻译,szdufeng,2017-01-09,"旅行翻译
多国语言
翻译
语言障碍",4.5
直捣电影,3,23644,100%,视频在线视频,,steven,2017-01-09,"1.提供最近热映电影展示（影院热映）
2.提供电影搜索（查询电影）
3.提供电影排行榜展示（电影推荐）
4.提供tab和内页的分享功能",5.0
嗨图,2,23474,100%,社交表情头像,搞笑段子媒体广告趣味阅读表情包,-Fionaaa,2017-01-09,微信制作专属表情包，蓝色大海的传说、鬼怪、网络热图....海量素材只要你想的到的全都有，一键换字炒鸡方便！斗图、发朋友圈装x，你逗逼道路上的神助攻get√（微信搜索小程序：嗨图）,5.0
听闻FM电台,6,23444,100%,音乐在线音乐,,听闻,2017-01-11,随时随地用语音来感受新闻热点的软件，奇闻、体育、娱乐、财经、科技、真人录制每日在线更新。,5.0
霾太,0,23403,0%,工具天气,雾霾效率空气质量雾霾预报,霾太,2017-02-03,关注空气质量，7天雾霾预报,0.0
豆果美食菜谱精选厨房必备,1,22868,80%,生活美食,菜谱提升厨艺美食推荐,豆果美食,2017-01-09,最 In 的美食推荐、最贴心的时令食材、最多样的菜谱方案，随时随地 hold 住你的胃，变革你的厨房体验。豆果美食，开启美味生活。,4.0
伴米说,2,22797,90%,音乐在线音乐,,????CharlieChee?,2017-01-10,【伴米说】聚集了来自世界各地当地人诉说的好玩有料的语音；他们将自己的知识、经历等信息分享给你听！,4.5
笑逗吧,4,22654,90%,社交娱乐,搞笑有趣视频搞笑图片搞笑视频幽默,东莞科创软件有限公司,2017-02-08,为了统治地球，不，是宇宙，我们决定用白痴、搞笑的图片和影片征服人类和外星人。愚蠢的人类，准备『笑?死』吧。,4.5
句逗,3,22380,100%,阅读杂志,搞笑段子媒体广告趣味阅读趣味聊天,caicheng,2017-01-09,"句逗-与喜欢的句子不期而遇

这里只有句子，严肃的句子，励志的句子，唯美的句子，心动的句子，伤感的句子，愿你每天能遇到一句让你赏心的话，一幅悦目的图，更愿你因此天天有个好心情。",5.0
