小程序名称,评价人数,人气,好评率,分类,标签,作者,发布时间,小程序介绍,评分
硬老师,1,15676,20%,健康运动,健身私教健身训练课程运动瘦身,硬老师,2017-01-24,硬老师是你随身携带的健身私教，专注于为你打造更科学的健身训练课程，为你示范更靠谱的硬派健身大法。,1.0
足球魔方社区,3,15637,94%,体育足球,足球体育,魔方元科技,2017-01-09,足球魔方系魔方元倾力打造的中国最大的赛前大数据决策平台，使用独创的DeepCube人工智能算法，结合比赛基本面、球队技战术大数据、前方情报等多维度分析，提供前所未有的可视化信息和用户体验。,4.7
火车票预订查询,0,15636,0%,出行交通,交通出行火车票,火车票预订查询,2017-01-12,"艺龙旅行网为消费者提供全球200多个国家75万家酒店住宿及机票、火车票等预定服务；是中国在线和移动住宿服务提供商,致力于打造专注专业、物超所值、智能便捷的住宿预订平台,通过艺龙客户端、PC网站、24小时预订热线（4009-333-333）",0.0
户外活动助手,0,15588,0%,旅游攻略,旅游线路旅游攻略社交户外活动,户外活动助手,2017-01-19,户外活动助手8264活动平台的微信小程序版本。是国内首推专注于户外的线路平台，涵盖国内外户外旅游线路，为用户提供专业的报名咨询服务。,0.0
健身之家网,0,15582,0%,健康运动,美食健身社交,健身之家网,2017-01-17,健身之家是一个健身朋友互动交流的健身类平台，这里有完备的肌肉网络体系、专业的健身计划、详细的增肌减脂教程,0.0
藏识相册,0,15538,0%,图像美化滤镜,美图社交,RR,2017-01-08,本应用是一个玉石文玩类的图片应用，用户可以记录并分类自己珍藏的物品，也可以鉴赏他人珍藏的物品。,0.0
月记Lite,0,15498,0%,母婴经期,经期管理避孕备孕神器,itisalex,2017-01-09,大姨妈月经期管理软件，避孕备孕神器，女生必备。独创的经期小日历、独创的经期对比日历。,0.0
王者早知道,0,15465,0%,阅读资讯,王者荣耀腾讯游戏娱乐手游,TmT团队@腾讯微信,2017-01-09,「王者荣耀」新鲜资讯不错过，精彩内容早知道。版本强势划重点；体验服英雄提前看；高清壁纸任性换。,0.0
腾讯体育+,5,15421,84%,体育综合,视频体育新闻赛事直播,腾讯体育+,2017-01-17,腾讯体育小程序二维码可以直接让网友们扫码进入腾讯体育在下直播间，腾讯体育小程序再也不需要开启腾讯体育app就能够直接在手机上通过腾讯体育小程序观看BNA等体育赛事的实况直播咯！腾讯体育小程序还有相关体育新闻观看。,4.2
邑小助,0,15408,0%,社交社区,,会玩网络,2017-01-09,五邑大学兼职信息查询及发布平台，提供五邑大学各种生活所需功能，包括查询电费、校内常用电话等,0.0
贝塔基金宝,0,15408,0%,金融理财,基金投资理财金融保险,513868087,2017-01-09,协助投资人可视化展示各类金融产品（基金、私募、集合计划、保险、理财、投资人物等）、科学分析客户持仓资产和配置，让我们的投资有据可查,0.0
朝夕日历Pro,0,15406,0%,工具日历,日历生活服务效率,小朝,2016-12-30,朝夕日历―智能的时间助理；长按添加按钮可以语音添加日程；提供列表视图；帮助您简简单单地安排时间，发现生活~,0.0
彩票速查,4,15439,96%,工具查询,彩票工具查询,彩票速查,2017-04-28,提供福彩、足彩、时时彩开奖结果查询,4.8
健康家居4+,3,15398,94%,购物商城,商城家居生活服务健康家具,健康家居4+,2017-01-17,专营自主原创设计的健康家具和健康机能产品，推广健康家居生活。,4.7
第三视觉互动,0,15320,0%,阅读资讯,设计开发社交,岗伯伯,2017-01-09,第三视觉公司介绍，业务范围，联系方式等。,0.0
书法字帖大全,1,15305,100%,工具查询,学习工具学习辅导书法,方方,2017-01-09,历代名家书法碑帖大全，练字临帖必备！,5.0
算车价,0,15298,0%,生活汽车,购车资讯汽车报价购车,玩车教授,2017-01-10,"2017年最新的购车计算器,方便购车者计算购车时所产生的各种税费(购置税、上牌费用、车船使用税等)以及商业保险。",0.0
实时空气质量,0,15296,0%,生活,生活服务效率,乡居网,2017-01-09,提供全国各地实时空气质量，包含PM2.5、PM10、一氧化碳CO、二氧化氮NO2、臭氧O3、二氧化硫SO2，帮你避免空气污染带来的损害。,0.0
中港车之家,6,15266,100%,旅游旅行,中港车,港澳城旅游(深圳)有限公司,2017-04-07,港旅城，专注香港邮轮，中港车，一站式VIP服务,5.0
健康吃啥,1,15232,100%,生活美食,菜谱提升厨艺美食推荐,健康吃啥,2017-01-13,个性化推荐当令食物。根据身体状况，包含体质，慢性病，小症状，结合不同节气的智能推荐系统。,5.0
经期月月记,0,15201,0%,母婴经期,女性健康生活服务,张怡,2017-01-09,科学预测你的经期，从此告别大姨妈随时探访的尴尬。来月经，就用月月记~（产品截图部分是我们未来版本的预告图~敬请期待哦~）,0.0
碧桂园凤凰国际酒店,0,15197,0%,旅游酒店住宿,酒店服务,懒人,2017-01-09,"碧桂园凤凰国际酒店涵盖商务、滨海、温泉、高尔夫、山水与草原等六大主题酒店。
酒店直营，你懂的~",0.0
车来了精准的实时公交,12,15150,92%,出行交通,,knightliao,2017-01-11,精准的实时公交APP,4.6
秀赞问卷,0,15145,0%,社交社区,投票问卷调查,范范,2017-01-10,快速制作的调查、投票、问卷等活动！海量免费模板等你挑选，让制作更轻松，让页面更精美！,0.0
小易测速,1,15126,100%,办公办公软件,网速测试,翼帆网络,2017-01-09,小易测速是一款简单易用的测速工具，网速测试、4G、Wifi网络测速，结果快速准确。,5.0
十点读书程序,1,15079,100%,阅读资讯,,wolfme,2017-01-09,深夜十点，陪你读书，一种美好的生活方式。分享好书/故事/电台/美学。,5.0
小鱼收纳+,0,15076,0%,工具查询,物品整理收纳记录工具,小鱼收纳,2017-01-12,轻便的物品整理，收纳，记录工具,0.0
We重邮,0,15033,0%,社交社区,教育信息查询轻松办公,We重邮,2017-01-13,校园微移动门户，为全校师生提供便捷服务。校内头条、教务公告、OA公告、会议通知、学术讲座、综合新闻等，随时随地即能了解校园动态，还能预览与下载附件，掌上办公，指日可待。,0.0
叮叮出行,0,15029,0%,出行交通,交通出行,安德卤猪,2017-01-09,校园版嘀嘀打车,0.0
小布包,0,15019,0%,办公办公软件,轻松办公信息分享信息查询,小布包,2017-01-09,小布包是一个云端文件分享的小工具，有助于提高团队协作效率。小布包基于文件集合来自由地组织联系人/群组，轻松和安全地分享文件集合。,0.0
91影像助手,0,15004,0%,工具查询,医疗咨询医学知识医学影像查询,susan,2017-01-09,"「91影像助手」是一款医学影像查询工具，搭建了一个医学影像信息数据库，用户可以通过点击分类菜单栏、输入关键词搜索查询医学影像的相关内容。「91影像助手」隶属于杭州至临医疗科技有限公司（以下简称”至临医疗科技”），主要为医生群体提供系统化、便捷化的医学影像信息查询服务。
医生在工作和学习中遇到需要查询资料的情况时，可以通过检索「91影像助手」来获取相关信息。",0.0
篱笆闲聊,0,14967,0%,社交社区,搞笑段子媒体广告趣味阅读趣味聊天,甜菜冬瓜,2017-01-09,篱笆闲聊  - 伴你经历人生中的每个重要时刻！年轻家庭，生活消费社区。,0.0
汽车之家Autohome,0,14944,0%,生活汽车,汽车资讯汽车报价,Joe_志文,2017-01-10,帮您迅速筛选热门车型，上市新车，一手汽车资讯--汽车之家，,0.0
背宝,0,14926,0%,教育单词字典,学习工具英语单词速记,liro,2017-01-09,随时随地背几个单词、背几处知识点，帮助您在不知不觉中提高成绩、增长学识。,0.0
微店买买,0,14895,0%,购物商城,,Henson,2017-01-09,微店买买小程序，帮助用户管理自己的订单与收藏，与熟悉的商家保持联系，在微店交易更加方便安全。,0.0
启信宝商业搜索,0,14861,0%,金融创投,信息查询商业搜索,启信宝,2017-01-10,启信宝是一款快速精准的企业信息查询工具，为各界人士提供丰富详尽的企业信息检索，尤其能帮助金融从业者、律师、投资人、媒体记者、销售与管理等专业、商务人士提供全面、客观、权威的工商、投资、司法拍卖、资质、许可、处罚等企业信息，是各界商务人士必备的企业征信利器。,0.0
教师证题库大全,4,14845,100%,教育学习,教师资格证小程序小学教师资格证书幼儿园教师资格证书中学教师资格证书,ringo,2017-02-05,考过鸟同步官方最新教师考试改革大纲，涵盖幼儿园、小学、中学资格证全部题库。科学系统学习，让你轻松拿证就业。,5.0
嗨住租房,0,14839,0%,生活房产,计算工具买房必备房产信息装修顾问,钱赵力@hizhu.com,2017-01-09,"嗨住，一个专业的租房平台，为您提供更真实更便捷的创新一站式租房服务。让租房世界从此变得简单而温暖。在我们不断的改进和优化中，力求让更多的用户获得前所未有的体验。
― 智能+人工，双重筛选，保证所有房源真实有效，让找房不再海量筛选；
― 0元中介费，让“不收中介费”的找房神话不再是传说；
― 第三方监管，房租押金有担保，先行赔付；
― 白条付租、信用卡付租、室友征选、搬家、维修更多服务，请移步任意手机应用市场下载“嗨住”。

【联系方式】
1、微信公众号：嗨住hizhu                           
2、微博账号：嗨住hizhu
3、服务热线：400-8786-999",0.0
日历e,0,14828,0%,工具日历,日历日程查询万年历,邓仔,2017-01-06,日历、日程查询，万年历等各项日期相关服务查询,0.0
南方基金微理财,0,14781,0%,金融理财, 基金投资理财金融保险,movieatravelove,2017-01-09,南方基金小程序，集现金管理、基金交易、净值查询等多种功能于一体，致力于做您最贴心的掌上财富管家，让您随时随地轻松理财！,0.0
小蚁AI艺术,0,14764,0%,图像美化滤镜,美图学习工具娱乐,小蚁张工,2017-01-08,小蚁AI技术，深度学习画风，一键将照片变身艺术品,0.0
桔子创投内参,0,14762,0%,金融创投,投资创业社交,Zealen,2017-01-08,桔子创投内参，是一款创业与投资的红宝书，汇集了每日创投领域最干货的文章。,0.0
通勤助手,1,14664,100%,出行交通,交通出行路线推荐,Answer,2017-01-09,"・ 随时查看上下班的路况，为您推荐最优路线，再也不用担心时间都耽误在路上啦！
・ 内急怎么办？通勤助手为你快速找到附近的厕所！舒坦！",5.0
飞机票查询预订,0,14627,0%,出行交通,飞机票航班查询住宿,飞机票查询预订,2017-01-12,"艺龙旅行网为消费者提供全球200多个国家75万家酒店住宿及飞机票、火车票等预定服务；是中国在线和移动住宿服务提供商,致力于打造专注专业、物超所值、智能便捷的住宿预订平台,通过艺龙客户端、PC网站、24小时预订热线（4009-333-333）",0.0
快销上报,0,14610,0%,办公办公软件,轻松办公金融,快销上报,2017-01-09,1、门店销售上报，结合定位与图片上传；2、方便业务员扫码上报数据，简化录入流程；3、销售数据及时反馈，及时了解市场变化,0.0
二更+,13,14607,98%,视频在线视频,视频社交最新资讯,二更+,2017-01-19,原创精品短视频平台，带你发现身边不知道的美。,4.9
理财小算盘,0,14571,0%,金融理财,计算工具买房必备投资理财装修顾问,xinqian,2017-01-09,提供理财所需的计算器，如定投，贷款，汇率计算等。,0.0
开眼视频 Eyepetizer,0,14536,0%,视频在线视频,,开眼视频,2017-01-09,开眼视频，每天精彩短视频推荐。美食、运动、旅游视频,0.0
家装精品案例,0,14518,0%,生活家装,家装案例装修顾问买房必备装修资讯,家装精品案例,2017-01-09,家装精品案例，每套案例从客厅、餐厅、厨房、书房、卧室等空间出发，贯通其设计及搭配妙法，展现一个完整地设计灵感。,0.0
MOTIF米田图案壁纸小工具,1,14514,100%,图像美化滤镜,美图社交,Stan,2017-01-07,MOTIF热爱传统图案热爱四方连续，在这里把图案变成壁纸、装点文字，希望有更多人了解图案的美妙。,5.0
百姓MINI,0,14493,0%,生活家政服务,家政找工作二手家电车辆房地产,百姓MINI,2017-01-12,家政、找工作、二手家电、车辆、房产等，快速查询，优质生活信息一手掌握。,0.0
网易灰评,2,14486,100%,阅读资讯,商城购物攻略生活服务,Aaron,2016-12-30,网易旗下首个独立的第三方商品评价体系,5.0
微快递+,0,14463,0%,工具查询,快递查询,快递助手,2017-01-09,微快递+是为用户提供快递综合解决方案，提供最全查快递、寄快递，提升客户的快递使用体验和满足个性化服务需求。,0.0
水滴互助应用,0,14462,0%,健康健康,社交筹款申请爱心筹款粉丝应援,别重复,2017-01-09,水滴互助是面向大病/意外的互助社群，一人患病，众人均摊。关爱自己、呵护家人，与百万会员抱团抵御健康风险。已获美团-大众点评、IDG、高榕资本等5000万元投资，徐小平、王兴等互联网大佬力荐。进入公众号点击“加入互助”了解互助计划,0.0
群应用,0,14444,0%,办公办公软件,办公企业管理,杨芳贤@IBOS酷办公,2017-01-09,群主管理群的小程序，名片、名片夹、群友通讯录等...,0.0
天天P图,0,14422,0%,图像美化滤镜,美图图片处理图片制作,天天P图,2017-01-17,"天天P图小程序是由深圳市腾讯计算机系统有限公司研发推出的小程序，能够一秒钟将你的照片变成美萌萌的大头贴。
　　进入天天P图小程序之后就直接点击下方的我要制作，你可以选择现场拍照，也可以选择从图库里面找出一张更美的照片，选好之后再挑选你喜欢的框架，然后点击保存图片就能分享给你的好友了！",0.0
第二空间创作中心,0,14365,0%,办公办公软件,效率企业管理办公,西安慢连互联网有限公司,2017-01-09,第二空间创作中心可以创作出图文并茂的文章,0.0
留学公寓助手,0,14242,0%,工具查询,生活服务房产信息公寓预订,SHU,2017-01-08,留学公寓助手，是由番茄留学公寓平台开发，免费为中国留学生提供学校及校外的学生公寓预订服务的小程序。,0.0
语音备忘房贷计算工具箱,0,14238,0%,工具计算器,计算工具买房必备房产信息装修顾问,owen,2017-01-09,提供万年历查询，天干地支信息，语音备忘功能及相隔天数查询；提供房贷计算器可方便查询贷款额度及月供金额等信息。,0.0
感恩笔记本,0,14193,0%,办公办公软件,笔记本记录日记,Zeo,2017-01-04,"感恩笔记本-用感恩的心看世界，记录生命给予的每一份美好礼物，拯救不开心。

美国脱口秀女王 Oprah 坚持写感恩笔记
已有十年，她鼓励所有人用感恩的心看世界，
记录生命给予的每一份美好礼物，
拯救不开心。",0.0
看剧小助手,1,14192,60%,视频在线视频,电视视频,二口南洋,2017-01-08,记录追剧的进度，新一季或新一集更新早知道。不再追剧追一半追忘记了！,3.0
米头条助手,0,14192,0%,工具日历,万年历定日子,那猫小帅,2017-01-09,本工具是一个关于万年历的小工具。提供本月胎神、吉神宜趋、忌、凶煞宜忌、宜、月相、喜神位、岁煞、彭祖百忌等的查询功能。,0.0
小密圈+,0,14181,0%,社交社区,社交学习,小密圈+,2016-12-27,"小密圈是创作者连接铁杆粉丝，做出高品质社群，实现知识变现的工具。

凯文・凯利提出过「一千位铁杆粉丝」的观点：任何从事创作或艺术的人，例如艺术家、音乐家、摄影师、工匠、演员、动画师、设计师、作家等，只要能获得一千位铁杆粉丝，就足够生计无忧，自由创作。

到小密圈建一个圈子，按年收费，为自己的热爱写作，为自己的朋友写作。第二年，大多数用户还会在，一次销售，提供好的内容，粉丝会和你连接得越来越牢固。你的压力可能不会减少，你的快乐和满足感一定会增加。",0.0
贴现助手,0,14107,0%,金融理财,票据行情金融股票证券计算器,都顺,2017-01-04,覆盖全部票据种类，实时呈现票据市场行情走势，显示最高最低价格。票据贴现利率计算器，年息月息自动转换，一键得出贴现利息。,0.0
Coolbuy玩物志,1,14054,100%,购物商城,商城生活用品护肤品,ifanr,2017-01-09,玩物志小电商平台,5.0
腾讯汽车小助手,0,14046,0%,生活汽车,计算工具购车资讯养车修车,腾讯汽车小助手,2017-01-18,汽车小助手为您提供便捷的汽车服务，帮您轻松选车，低价购车,0.0
墙蛙网,0,14031,0%,购物商城,商城,Blood.Xia,2017-01-10,墙蛙网提供装饰画、抱枕、手机壳等多种产品的个性化定制服务。同时，还提供海量艺术家原创衍生品销售。,0.0
房贷计算器免费版,0,14019,0%,工具计算器,计算工具买房必备房产信息装修顾问,金雨,2017-01-09,免费房贷工具，2017买房卖房必备。全面覆盖公积金贷款、商业贷款、组合贷款，利率实时调整，买房卖房专业房贷计算好帮手！,0.0
网红助手,2,14001,100%,社交娱乐,网红主播电商直播排行榜,bitflow,2017-01-19,网红助手是专业的直播效果分析平台，涵盖主流平台直播数据，支持最真实的直播数据查询，为了中播中可被估量的价值，让直播可感知,5.0
拼多多官方,5,14001,84%,购物团购,拼团购物商城,kant,2017-01-09,拼多多是一个让你和朋友一起拼团购物的小程序。拼多多，拼着买，更便宜。,4.2
腾讯房产小助手,2,13994,100%,工具计算器,房贷计算器商贷计算器,腾讯房产小助手,2017-01-20,房贷计算器,5.0
邀约小助手,1,13924,60%,社交社区,组织活动分享邀约日程管理,邀约小助手,2017-01-23,"聚会、约饭、组织活动？邀约小助手帮帮你

- 简洁明了的版面，轻松发起和分享邀约，管理自己的日程
- 参与者可以选择参加、待定、不来、默默围观等不同状态，一目了然",3.0
表情家园,4,13909,84%,社交表情头像,搞笑段子媒体广告趣味阅读表情,Longxi,2017-01-09,上传图片制作自己的表情图片，所有表情图片都可以改字。最全的表情包图片，有搞笑表情包，暴走表情包， 黄子韬表情包， 尔康表情包， 金馆长表情包， 斗图表情包， 带字表情包， 动态表情包。,4.2
美美买车＋,1,13885,100%,生活汽车,购车资讯汽车报价购车,美美买车＋,2017-01-13,中国最专业的体验式汽车电商平台。,5.0
泊心旅居官方,1,13863,80%,旅游酒店住宿,酒店预订火车票汽车票飞机票,泊心旅居官方,2017-01-19,酒店、公寓、别墅、民宿预订；机票、火车票、汽车票预订；包罗树屋、房车、游艇等各式新奇住宿；旅游度假、办签证、一站式服务,4.0
腾讯投票,0,13827,0%,社交娱乐,投票评选社交,腾讯投票,2017-01-17,腾讯投票小程序能够用在不能直接做出决定的时候发起投票方法来决定！腾讯投票小程序可以发起单选投票，也能发起多选投票，创建投票成功之后就可以直接点击右上方的分享功能，把它分享到你的朋友圈或者是微信群和微信好友！非常的方便哦！,0.0
GET小资讯,0,13821,0%,阅读资讯,新闻最新资讯视频,nick,2017-01-05,"GET小资讯是一个聚焦境外时政新闻、全球经济热点的资讯类小程序，通过大数据和当地亲历者，把境外主流媒体和报纸杂志的头条头版新闻带到你面前。在这里不仅可以找到CNN,BBC news媒体等关注的要闻，还能看到环球的百科知识和科普文章。",0.0
认真的虎扑足球,10,13807,94%,体育足球,赛事点评足球新闻足球故事,认真的虎扑足球,2017-01-20,虎扑足球官方小程序，提供认真的足球新闻、有趣的足球故事以及JRs的精彩评论。,4.7
e代驾Lite,0,13786,0%,出行交通,,e代驾Lite,2017-01-12,"【代驾服务，必选e代驾，竭诚为车主用户提供更全面、专业的车辆服务】
e代驾:中国代驾行业、中国代驾公司中毋庸置疑的行业标准制定者。
e代驾不止是代驾,更多的是一种生活方式。
e代驾师傅平均驾龄9年以上=安全 
e代驾师傅平均到达时间5分钟=快速",0.0
蚂蚁待办,0,13766,0%,办公办公软件,效率生活备忘录,ants,2017-01-03,最简洁的待办、提醒,0.0
腾讯挂号平台,0,13714,0%,健康健康,挂号预约医疗,腾讯挂号平台,2017-01-20,挂号平台,0.0
招行信用卡,0,13681,0%,金融理财,生活服务金融信用卡,招行信用卡,2017-01-13,招商银行信用卡小程序，向用户提供查账、查额、查积分的功能，可以快速查看已出账单明细和未出账单明细。,0.0
蚂蚁礼簿,4,13666,96%,工具计算器,记账云端储存,腊月乘凉,2017-02-06,蚂蚁礼簿是一款由腊月乘凉开发的云礼簿，能帮助用户轻松管理一切份子钱。设计理念巨专注，只做一件事：管理份子钱巨简约。,4.8
量子足球,9,13664,100%,体育足球,足球比赛体育,阿布,2017-01-10,"量子足球是一家专注于足球比赛大数据的公司，依靠公司独创的数据模型，对足球比赛数据进行实时分析，并通过多种展现方式，将比赛的进程展示给用户。
    量子足球是一家专注于足球比赛大数据的公司，依靠公司独创的数据模型，对足球比赛数据进行实时分析，并通过多种展现方式，将比赛的进程展示给用户。",5.0
实习委员,0,13640,0%,办公办公软件,求职招聘兼职,实习委员,2017-01-09,最垂直最高效的实习生招聘平台，让你赢在毕业的起跑线上,0.0
奇葩悦读,0,13586,0%,阅读资讯,搞笑段子媒体广告趣味阅读趣味聊天,吹竹,2017-01-09,奇葩悦读：一个充满趣味的互联网碎片化精品内容聚合平台，这里有段子手，有大V，有污妖王，还有卖萌妹纸，二次元Show Girl，还有脑洞大开媒体广告汪，单身专业户以及爱分享知识的老司机。你还在等什么？赶紧上车！,0.0
驾考宝典App,1,13550,100%,教育驾考,,驾考宝典,2017-01-11,驾考宝典，颇具人气的互联网综合驾照考试学车软件。学车必备驾考宝典，下载即送驾校VIP保过资格，用驾考宝典学驾照，全真题库不过包赔，满分就奖！,5.0
活力圈Go,0,13509,0%,健康运动,社交户外活动,活力圈Go,2017-01-20,圈有趣・动不同，超越过百种运动等你来玩，跟着活力圈一起体验运动大不同！,0.0
名堂,0,13487,0%,社交社区,社交商城最新资讯,名堂,2017-01-08,同城兴趣社交、电商平台，与有趣的人沟通。,0.0
加油卡充值,0,13478,0%,工具查询,汽车加油卡充值石油加油卡充值,等线牵的风筝,2017-01-10,由《一号养车》提供汽车加油卡快速充值服务，最快0.5小时内到账，支持全国各地的中国石油加油卡和中国石化加油卡的充值服务。,0.0
买房利器,0,13469,0%,工具查询,计算工具买房必备房产信息装修顾问,乐居控股,2017-01-09,为购房者提供找房、搜房服务。,0.0
模拟攒机,0,13443,0%,工具查询,装机教程虚拟装机,模拟攒机,2017-01-19,ZOL模拟攒机提供实用的自助虚拟装机平台，为用户推荐精选配置，便于用户筛选、收藏个性方案，浏览热门排行、装机教程等讯息。,0.0
汕头生活+,0,13428,0%,社交社区,搞笑段子媒体广告趣味阅读生活分享,红雨点苍苔,2017-01-09,"「汕头生活+」是第一款服务于区域自媒体的小程序，在这里你可以了解第一手的汕头新鲜事，浏览纯正的潮语搞笑视频，与潮人圈子的你我他激萌互动！
「汕头生活+」依靠于区域自媒体小程序平台 -- 海螺云（hailuoyun.cn）。海螺云致力于帮助公众号主以零技术的投入切入到小程序中，丰富小程序的生态，微信:dawnsail。",0.0
娱票儿+,0,13393,0%,生活票务,电影演出赛事门票,yuchen,2017-01-09,娱票儿小程序，是 “微信钱包电影演出票” 官方应用。为你打通电影、演出、赛事一站式购票，购票更快更优惠,0.0
麦当劳优惠券,3,13386,94%,生活美食,麦当劳优惠券,麦当劳优惠券,2017-02-03,消费者可以通过该小程序获取麦当劳最新优惠券并在门店进行出示使用。,4.7
多人相册,2,13371,100%,图像美化滤镜,纪念相册网络相册DIY相册视频,多人相册,2017-01-18,和加人、朋友、同事共同存放照片。你可以根据任意主题创建相簿，相簿中的照片将以原图保存，永不过期。,5.0
