小程序名称,评价人数,人气,好评率,分类,标签,作者,发布时间,小程序介绍,评分
功夫拼图,3,5464,100%,社交表情头像,协作搞笑,南京功夫豆信息科技有限公司,2017-02-10,创新的多人协作玩法，拼图一加一，我拼一张你拼一张，挥洒创意，总能让我们忍俊不禁。朋友一起才好玩～,5.0
图个乐表情,0,5463,0%,社交表情头像,搞笑段子社交搞笑图片表情,图个乐表情,2017-01-19,暴漫卡通动画明星表情，聊天必备斗图首选。只有你想不到的，没有你找不到的！ 更多功能，尽在图个乐。,0.0
拜年语,1,5453,60%,社交社区,拜年语祝福语春节祝福,拜年语,2017-02-01,拜年语提供了大量的春节祝福，可以查看热门祝福语，可以选择自己喜欢的祝福语复制到短信或微信中，在过年的时候发送给亲朋好友。,3.0
跳舞兰花店,0,5429,0%,购物商城,网上商城网上花店,深圳市跳舞兰科技有限公司,2017-02-09,跳舞兰是国内实名认证的O2O鲜花服务平台。拥有超过3.5万家实体花店。服务网络已覆盖全国，能够为您提供就近快速送花品质服务。,0.0
本地部落,0,5401,0%,阅读资讯,新闻最新资讯体育报道娱乐八卦,本地部落,2017-01-18,本地热点、时事要闻、娱乐八卦、军事观察、体育报道、科技精选...智能推荐，推荐你感兴趣的本地轶闻趣事，随时随地地发布身边事。,0.0
葡萄生活官方平台,0,5390,0%,母婴美妆,生活服务美容美妆家电清洗上门推拿,葡萄生活官方平台,2017-01-24,生活葡萄是一款严选的到家生活服务平台，为用户精选家政保洁、推拿按摩、加点清洗等100多种服务，并对各服务环节进行深度保障。,0.0
浴音阁,1,5373,80%,音乐在线音乐,轻音乐催眠音乐放松音乐,浴音阁,2017-02-05,睡觉、学习和放松时，请打开浴音阁，这里的声音带有宁静致远的平和质感，能让你平复心情、集中精力，同时能让你享受静谧与平静。,4.0
父母邦精选,10,5366,96%,旅游旅行,票务旅游路线酒店服务,花匠,2017-02-10,父母邦快乐亲子生活，独家预售精品儿童演出剧，超值度假酒店亲子套餐。,4.8
豪车保养费用查询,0,5339,0%,生活汽车,报价汽车维修,豪车保养费用查询,2017-01-17,比价再修车，不花冤枉钱，18年专注德系豪华车维修，华胜连锁全国150+家门店质保，每年为您节约40%费用！服务热线：4008033707,0.0
小活动lite,0,5330,0%,社交社区,报名户外活动预约,小活动lite,2017-01-24,年轻人的约局方式,0.0
小毛豆育儿,2,5310,100%,母婴育儿,育儿知识社交能力培养测评,小毛豆育儿,2017-01-23,0-3岁，吃、喝、拉、撒、睡、护理等全面育儿知识分享，认知、精细动作、语言、社交、大肌肉运动、自理等6大能力培养、测评,5.0
有钱兔择校,2,5252,100%,工具查询,工具信息查询周边搜索,有钱兔择校,2017-01-13,提供择校活动信息查询功能，供家长择校使用。,5.0
长隆会,0,5215,0%,旅游攻略,旅游娱乐,长隆会,2017-01-16,长隆欢乐世界的官方小程序，了解园区内的信息。,0.0
融360诚信助手,0,5186,0%,工具查询,信息查询,融360诚信助手,2017-01-17,融360诚信助手小程序可以帮你查询是否在机构黑名单上。主要包括：法院黑名单、分类信息中介黑名单、金融机构黑名单！,0.0
游戏王查卡器,0,5163,0%,工具查询,游戏王查卡器卡牌,Hugh,2017-01-28,游戏王卡牌信息查询工具一枚,0.0
华西二院,0,5144,0%,健康健康,医疗咨询医生在线就医指导,华西二院,2017-01-13,在线预约挂号、缴费、报告查询、检查预约、住院预交、视频讲堂一站式服务平台,0.0
雾霾早早知道,0,5127,0%,工具天气,生活服务效率健康,雾霾早早知道,2017-01-17,提前3天预测城市雾霾指数，为您的健康提前护航,0.0
家居大家,0,5098,0%,生活家装,装修家居房产信息装修顾问工具,家居大家,2017-01-17,搜狐焦点家居旗下高端线设计师产品，汇集国内顶尖设计师与设计作品。 搜狐焦点家居匠心出品「家居大家」――设计案例品质甄选，设计大咖一键预约！,0.0
女生日历,3,5097,100%,母婴经期,经期月经备孕怀孕,女生日历,2017-01-19,一款温暖的女性健康工具：经期记录很贴心，备孕怀孕很省心，云端存储很放心。,5.0
百城招聘min,0,5080,0%,工具查询,招聘求职找工作查询,百城招聘,2017-02-10,百城招聘，全国连锁！百城招聘min是百城招聘（BCZP.CN）旗下小程序应用。百城招聘min为求职提供全国各地最新的职位信息，随时随地查看投递简历，求职更轻松。,0.0
护眼宝+,2,5023,100%,健康健康,护眼护眼操,护眼宝+,2017-01-18,跟小护士做护眼操，3分钟消除疲劳,5.0
快讯通财经数据,0,5020,0%,阅读资讯,财经资讯信息查询经济数据播报财经视频,快讯通财经数据,2017-01-24,快讯通财经-财经快讯速递专家提供金融领域的实时要闻和市场行情报价，并提供最新的全球经济数据播报和专业财经视频。,0.0
映兔视频,2,5001,90%,视频在线视频,视频社交,映兔视频,2017-01-17,"映兔视频小程序有什么特色？
　　映兔视频小程序以用户为中心，把爱好、兴趣、生活融合在一起的小视频聚合平台。
　　映兔视频小程序可即可推送你要的主题，精选有意思的视频，旨在让你享受观感兴趣的视频内容。
　　通过映兔关注自己感兴趣的话题小视频，我们会跟踪、更新，并推送给你想要的内容。
　　在映兔，没有你不喜欢的内容，没有强制的推送。做懂你的小视频聚合平台。",4.5
掌上探路者生活,0,4989,0%,旅游攻略,旅游线路旅游攻略社交户外活动,掌上探路者生活,2017-01-18,想寻找新鲜有趣的活动？结交趣味相投的玩伴吗？发活动一呼百应？运动竞赛棋逢对手？掌上探路者，开启你的健康lifestyle，约起！,0.0
我心咨询,0,4951,0%,教育儿童教育,心理咨询情感咨询心理,我心空间,2017-01-18,"我心咨询，一个集情感倾诉、释放压力、缓解焦虑、吐槽分享于一体的心理健康小程序，打造“关爱、专业、健康、人本”的心理咨询及心理健康平台，帮助更多人用心理学改善生活，减少烦恼，增加心理知识，是『我心』的奋斗目标！

专业心理咨询、婚姻情感倾诉咨询、专业/趣味心理服务平台",0.0
录音,0,4907,0%,社交娱乐,录音社交,录音,2017-01-17,“录音”是一款便捷的录音小工具，在微信里可以快速录音，并且将录音分享给好友。目前1.0版本暂时只支持录60″以内，后续将开放更多新奇有趣的功能。,0.0
小晓资讯,0,4846,0%,阅读资讯,新闻财经最新资讯,小晓资讯,2017-01-17,小晓资讯小程序每天都会为你带来在科技前沿最新的时讯消息，当你通过扫码进入小程序之后，你会直接看到一个界面，在小晓资讯标题的下方，你会看到有头条、财经、体育、娱乐、科技等这样一些栏目，里面有许多有用的生活小常识，以及一些社会新闻，都是非常有用，甚至在某些时候都能够帮助到你！,0.0
红酒宝典,0,4829,0%,工具查询,红酒价格查询红酒品牌查询红酒年份查询,红酒宝典,2017-01-28,一键查询酒款、酒庄信息，1855列级庄大全,0.0
天天车价,0,4808,0%,生活汽车,车价汽车报价比价4S店报价汽车,天天车价,2017-01-20,专业网上购车比价平台。为用户提供4S店真实报价、低价保证和在线比价等服务，让购车者足不出户即可获得汽车报价。,0.0
小哒漫画,1,4797,100%,阅读漫画,在线漫画原创,小哒漫画,2017-02-15,我是小哒，一个头上有犄角的姑娘，用段子吐槽感情，用鸡汤温暖伤害，用撩人的小哒，治愈每一个你，我们~都是好姑娘。,5.0
有可能微课,1,4776,60%,教育学习,在线教育培训学习,有可能微课,2017-02-07,有可能微课提供在线的编程入门教学和练习。,3.0
火影忍者赛事,2,4757,100%,社交,社交娱乐,火影忍者赛事,2017-06-08,火影忍者赛事，是服务玩家的优质内容平台，热门赛事直播、点播、官方最新动态及赛事内容，将在这里第一时间呈现。,5.0
国美商城,0,4711,0%,购物商城,国美国美在线国美商城国美电器,国美在线电子商务有限公司,2017-01-28,品质，低价，速达,0.0
餐厅云,0,4688,0%,生活美食,生活美食,餐厅云,2017-06-09,餐厅解决方案,0.0
羽毛球精选报导,0,4672,0%,健康运动,羽毛球体育资讯视频,羽毛球精选报导,2017-01-18,每天三分钟羽毛球精选报导！,0.0
爱此购,1,4640,100%,购物商城,购物商城,爱此购,2017-06-08,爱此购，顾名思义：一款用户喜欢用它来购物的一款淘宝、天猫商城导购APP。每日更新推荐人气商品、特价商品、淘宝内部优惠券等。,5.0
iladylite,0,4622,0%,购物商城,护肤品商城购物攻略生活服务,iladylite,2017-01-17,"iladylite小程序有什么特色？
　　【时尚潮流】iladylite小程序上给大家推荐的一些服装都是国际最时尚的潮流搭配！
　　【明星代言】在iladylite小程序你会看见许多国际明星为这些商品代言！
　　【低价折扣】大牌的商品，只卖大众的价格，省钱不打折！",0.0
汽车之家口碑,0,4599,0%,生活汽车,工具车辆评价,汽车之家口碑,2017-01-16,汽车之家旗下口碑产品，为选车用户提供真实车主车辆评价参考,0.0
东航旅行,4,4600,100%,旅游旅行,交通出行火车票酒店飞机票,东航旅行,2017-01-18,东方航空旅游度假预订官方渠道，可完成机票+酒店的动态组合预订，价格价格更优。如有问题，请咨询官方热线95530,5.0
嘌呤查询,0,4524,0%,健康健康,健康健康,嘌呤查询,2017-06-09,为痛风及高尿酸患者提供食物嘌呤查询。,0.0
创投大全,0,4520,0%,金融创投,信息查询投资创业,创投大全,2017-01-17,创投大全由创业邦开发的创投信息查询工具，可检索海量最新投融资事件、初创公司、创业者、投资机构、投资人。,0.0
九库阅读,0,4507,0%,阅读电子书,小说名著古言现言,九库阅读,2017-01-24,原创小说，尽在九库阅读。九库阅读为您提供精彩无限的在线小说阅读。,0.0
亲戚计算器,0,4491,0%,工具计算器,亲戚计算器亲戚关系,亲戚计算器,2017-01-20,亲戚关系计算器,0.0
买画,0,4469,0%,购物商城,艺术品商城名画,买画,2017-01-18,买画是第一家艺术品特卖电商应用，是艺术品电商创新模式的引领者，为用户提供完美的线上购买艺术品体验。,0.0
酷客多,0,4452,0%,购物商城,购物电商商城线下超市,深蓝,2017-02-10,酷客多便利店，专业水果升仙网购品牌，优选鲜果，,0.0
浦发信用卡,1,4429,100%,金融理财,浦发信用卡银行,浦发信用卡,2017-01-24,为用户提供准确、快捷、实时的浦发信用卡服务，满足用户生活、消费、金融等各方面需求。,5.0
芝麻记账,2,4427,80%,金融理财,记账工具计算器,芝麻记账,2017-02-08,使用芝麻记账，可以方便的记录当月的花费情况,4.0
拉勾招聘,1,4421,80%,工具查询,找工作招聘信息查询,Charming,2017-02-07,拉勾网官方小程序，用户可以查找自己感兴趣的互联网公司，浏览该公司的介绍、在招职位信息、面试评价。,4.0
烟查查,0,4392,0%,工具查询,工具查询香烟,烟查查,2017-06-10,产品信息查询服务,0.0
同享好房,0,4384,0%,生活房产,计算工具买房必备房产信息装修顾问,同享好房,2017-01-13,《同享好房》根据购房者需求，智能推荐广州万科在售项目信息，同时直连万科三好顾问提供免费咨询、免费接送看房等服务!,0.0
百草味京东自营旗舰店,1,4377,100%,生活美食,百草味干果零食商城,百草味京东官方旗舰店,2017-01-20,百草味--趣味零食探索家，互联网休闲食品领先品牌，稳居行业前三甲。主营坚果炒货，肉脯肉干等休闲食品。,5.0
房天下买房,0,4347,0%,生活房产,计算工具买房必备房产信息装修顾问,房天下买房,2017-01-13,"房天下买房是国内领先的房地产门户房天下推出的一款购房应用,覆盖全国600多城市,囊括当地98%以上的新房、二手房、房价信息。",0.0
今日历史查询,2,4335,100%,工具查询,工具新闻历史查询,今日历史查询,2017-01-19,为用户提供专业的今日历史信息查询,5.0
房超找房,0,4330,0%,工具查询,找房子购房房产交易,房超找房,2017-02-07,房超找房是让购房者能够通过关键字，区域等找到合适的新房，查看新房的户型以及基本信息。,0.0
荔枝资讯,0,4325,0%,阅读资讯,搞笑段子新闻养生资讯,荔枝资讯,2017-01-24,网罗优质资讯，个性化推荐您感兴趣的文章，阅读越多，推荐越贴心！,0.0
陪你跑+,1,4259,80%,健康运动,社交户外活动跑步计步信息,陪你跑+,2017-02-09,企业人员每天和每月的计步信息以及排名，企业之间每天和每月的平均计步信息以及排名，个人在过去30天的每日计步数,4.0
香蕉表情,0,4244,0%,社交表情头像,社交表情头像斗图,香蕉表情,2017-02-06,香蕉表情，提供最有趣最全的表情，逢年过节斗图就靠香蕉表情，给你提供最流畅的斗图经验!,0.0
知亦行博物馆,0,4243,0%,阅读漫画,商城展览最新资讯,知亦行博物馆,2017-01-17,随时掌控那些不能错过的展览,0.0
扭扭脖子,2,4208,100%,健康运动,健康娱乐扭扭脖子段子,Shnicky,2017-02-05,小程序名字叫做“扭扭脖子”，因为它的功能就是为了让你“扭扭脖子”，通过一个比较“有趣的方式”，10秒钟让你读一个段子，缓解一下颈椎疲劳。,5.0
生日工具,2,4194,80%,工具日历,生日备忘录提醒,magic,2017-02-10,生日工具是一款生日提醒软件。 使用生日工具可以方便地管理父母、亲戚、同学等人生日，并设置时间。支持选公历显示农历功能。工具每天云端数据备份保证您数据的安全，小程序夸平台使用，使您再也不会担心忘记朋友的生日。,4.0
投资闹钟,0,4170,0%,金融理财,金融 投资 理财 股票 基金 外汇 贵金属 期货 现货 闹钟,投资帮,2017-02-05,小而美的金融投资提醒工具,0.0
小立报名,1,4151,100%,社交社区,预约报名活动社交,白玉雄,2017-01-17,报名小程序，用户可以发起一个活动，发送给好友参与报名。报名过程中发起人可以随时查看报名数据。,5.0
汇率随手算,0,4148,0%,工具计算器,投资理财金融汇率换算,汇率随手算,2017-01-19,随时随地查询各国汇率，随时换算任意两种货币的兑换。,0.0
音乐圣经黑胶库,1,4130,100%,音乐在线音乐,在线音乐古典音乐交响乐,音乐圣经黑胶库,2017-02-13,一个供我们了解黑胶唱片和古典音乐、分享交流心得的平台,5.0
驾考大本营,2,4104,100%,教育驾考,驾考宝典驾考帮手考驾测试题,驾考大本营,2017-01-24,驾考大本营采用公安部最新驾校模拟考试题库，提供最新科目一和科目四模拟考试。考驾照、做考试模拟试题就来驾考大本营。,5.0
角蛙动图,1,4093,100%,社交表情头像,GIF动态图片表情包斗图,深圳视享科技有限公司,2017-01-23,有趣的图片都是会动的~,5.0
卓越早教网,1,4087,100%,母婴育儿,早教母婴育儿,卓越早教网,2017-02-07,"卓越早教,关注0~6岁婴幼儿早期教育。",5.0
酷开大内容,1,4081,100%,视频在线视频,影视音频图片硬件与设备,酷开大内容,2017-01-20,酷开大内容，陪你一起看。小程序“酷开大内容”同创维电视绑定后，可以实现影视搜索，视频推送和远程遥控器的功能。,5.0
表情包包包,0,4069,0%,社交表情头像,表情包制作图片gif动图二次创作人脸识别拍立得电影宽屏,童童阳光,2017-01-18,表情包包包是一个表情图片制作和分享的软件，多种图片模式，人像自动识别，海量文字选择，支持GIF和素材的二次创作。你可以快速的发现、制作、二创、收藏、分享有趣的表情包，更可以随时随地记录生活分享心情。,0.0
永春土特产,0,4048,0%,生活美食,生活美食,永春土特产,2017-06-09,永春土特产，提供福建泉州永春地区特产采购销售服务，为永春健康农产品提供销售平台，带给您最纯正的家乡味道，关注永春土特产！,0.0
蚂蚁绊大象2,0,4043,0%,阅读资讯,搞笑段子搞笑图片最新资讯趣味阅读,蚂蚁绊大象2,2017-01-24,超级搞笑的原创段子！只要努力，人人都是段子手！,0.0
花瓣lite,0,4026,0%,社交表情头像,动图表情搞笑图片,花瓣lite,2017-01-20,花瓣动图搜索，表情、朋友圈配图神器,0.0
汇率查询换算,0,4022,0%,工具计算器,汇率查询换算金融工具,伍伍,2017-01-20,提供世界各国货币汇率换算查询,0.0
老虎淘股,1,4010,100%,金融理财,股票证券金融理财资讯,老虎证券,2017-02-07,老虎淘股主要为用户提供优质的美股相关资讯和文章。特点是可以按照标的不同的维度，将关键的资讯整理总结后提供给用户阅读。,5.0
有书想读,1,3998,60%,阅读电子书,小说读书阅读,有书想读,2017-01-20,　有书想读小程序二维码是有书想读微信公众账号当中的有书想读小程序入口。有书想读小程序是一款为爱读书的用户服务的小程序应用，在这里有丰富的书籍内容，总能找到你想读的书。有书想读小程序让你选择你想要读的书籍，并写上你的对这本书的心愿，为何想读。在有书想读小程序吸引更多的人与你将这本书籍的阅读成为心愿。有书想读小程序将会每个月根据榜单的心愿前十名的书籍进行共同阅读拆书的安排。在有书想读小程序点击添加阅读心愿即可进行书籍搜索，并找到你想阅读的书籍，写上心愿然后发布。然后在有书想读小程序中就会获得众多网友的赞，获得的越多，想读的心愿越多就有得到共同阅读拆书的机会。,3.0
高尔夫抢购,1,3974,80%,购物商城,高尔夫折扣优惠商品资讯户外运动,高尔夫抢购,2017-02-08,高尔夫大战最新“高尔夫抢购”小程序，不断推出各类高尔夫折扣优惠商品，欢迎常来抢购！,4.0
云阅文学MiniAPP,0,3958,0%,阅读听书,小说免费小说原创小说都市言情玄幻,云阅文学MiniAPP,2017-01-16,云阅文学miniapp是云阅文学app在微信小程序功能里面的精简应用，云阅文学miniapp是通过扫码进入、无需下载的电子书阅读器，为大家提供了各类原创在线小说，有言情、都市、玄幻等等！,0.0
迈迪词典,1,3944,100%,教育单词字典,德语词典英语词典汉语词典德汉词典英汉词典,德国大叔,2017-01-28,百万词库，详细释义，十年励剑，只为给你更多。迈迪词典，提供全面准确的德语、英语、汉语翻译。,5.0
大庆运盛网络服务,0,3924,0%,办公办公软件,办公办公软件,大庆运盛网络服务,2017-06-09,企业建站服务、品牌创意支持、互动营销、微展示、新媒体社交广告的多元化一站式互联网营销服务企业。,0.0
爱威信+,0,3908,0%,阅读资讯,热门头条美食旅游,爱威信+,2017-01-20,提供威信本地热门头条、美食、旅游等特色资讯。,0.0
车行易车务违章查询代办,3,3900,100%,工具查询,交通出行信息查询,车行易车务违章查询代办,2017-01-13,覆盖全国330多地市的交通违章查询代办服务，免费查询，实时提醒，快速在线缴罚款，车主最贴心的违章助手！,5.0
微警,0,3891,0%,工具查询,交通出行交通违法,微警,2017-01-24,微警是广州南沙警方联合广州交警（网上车管所）等单位开发的便民服务平台。可办理交管等公安业务。,0.0
互动吧精选,1,3883,100%,社交社区,社交培训,互动吧精选,2017-01-16,互动吧最大活动平台官方小程序，海量精彩活动覆盖全国，提供亲子幼教、运动健身、旅行户外?、派对娱乐、商务会议、职业培训等多种活动选择，打开更轻便，美好生活一触即发。,5.0
智投云管家,0,3877,0%,阅读资讯,新闻社交最新资讯金融,智投云管家,2017-01-13,面向投资机构的一款创投新闻聚合平台,0.0
查路费,1,3868,100%,工具查询,高速公路查路费高速路费收费站,陈海宏,2017-01-23,"查路费小程序是一款非常实用的路费查询辅助工具。查路费小程序可以帮助大家查询高速公路通行费（过路费），只需要你输入出发地和目的地，点击【查询】就能查询出你所需要在高速公路上花费的金额。快使用微信扫描二维码查询吧，不要多花一分冤枉钱！

　　查路费小程序主要是帮忙广大车主、司机查询高速路费，路费查询条件：
　　１）高速公路各路段全程不间断；
　　２）目前只支持属于广东省类的路费查询！",5.0
会简单,0,3852,0%,社交社区,聚会娱乐,会简单,2017-01-17,"会简单小程序目前体验情况还不错，打开会简单小程序网友们即可看到各类聚会的帖子,点击参加报名即可参与到聚会中。各类线下活动聚会尽在会简单小程序。还在发愁线下聚会组织不了吗?赶紧扫一扫会简单小程序,线下聚会不是梦。",0.0
闪电汇率,0,3836,0%,工具计算器,投资理财金融股票证券汇率换算,闪电汇率,2017-01-16,强大的汇率换算工具，实时线上获取最新汇率，操作简单，一目了然，是您管理自己财产的好帮手，出国旅游必备工具。,0.0
手机号归属地查询,0,3826,0%,工具查询,生活服务信息查询手机号查询,手机号归属地查询,2017-01-17,手机归属地提供全面的手机号码归属地查询服务，包含有电话号码、移动手机号码、联通手机号码、固定号码归属地查询。,0.0
海南新房导购,0,3803,0%,生活房产,看房吗海南新房房产资讯,rui zheng,2017-01-18,看房吗网是海南最权威的旅游地产网购平台，独有置业专家楼盘评测、无人机楼盘航拍带您身临其境了解海南楼盘信息。,0.0
珠宝鉴定查询,0,3792,0%,工具查询,珠宝鉴定信息查询,珠宝鉴定查询,2017-01-17,珠宝鉴定查询小程序里面可以看到全国各大珠宝玉石鉴定中心的查询点，只要你把你购买的商品商标上面的校验编码输入到查询框内，就能快速查询是否有效，让你知道自己买的珠宝是不是真的！在微信里面有一个这样的小程序就可以在你购买的时候查询清楚，就不会事后发现不对再去退货也非常麻烦！,0.0
喜梦时尚家纺,0,3791,0%,购物商城,家纺购物商城,喜梦时尚家纺,2017-02-13,喜梦时尚家纺具有十年的时尚个性成人家纺品牌，高贵品质，实惠价格。美好生活，喜梦相伴！,0.0
品玩市集,1,3774,100%,购物商城,购物商城,品玩市集,2017-06-08,Pingwest 品玩旗下的电商项目，一个生活方式的便利店。,5.0
凯叔故事,0,3741,0%,阅读听书,有声读物睡前故事性格养成,凯叔故事,2017-01-18,凯叔哄睡、凯叔唤醒、中外传统故事、节日故事、西游记、黑猫警长、恐龙、通话、绘画故事，为各年龄段宝宝精选的凯叔故事频道。,0.0
微信辟谣助手,0,3742,0%,生活家政服务,生活家政服务,微信辟谣助手,2017-06-09,搜索识别谣言，接受辟谣提醒，查看接触过的谣言及辟谣信息,0.0
吉他课,1,3730,100%,音乐在线音乐,音乐民谣电吉他吉他教学,吉他课,2017-01-17,"吉他课小程序有什么特色？
　　吉他课小程序目前为大家开放了民谣、电吉他、尤克里里还有古典风！
　　吉他课小程序为大家提供的教程有陈亮指弹吉他系统教程、三月通吉他自学、卢家宏指弹吉他教学、张文忠民谣吉他经典教学、左轮吉他教程和Nancy吉他教学！",5.0
微众银行,1,3683,80%,金融理财,网银银行存款理财,微众银行,2017-02-08,微众银行―国内首家互联网银行，足不出户体验存款服务，包含活期，定期存款。是您的理财好伙伴。,4.0
人民日报数字报,2,3680,100%,阅读杂志,新闻信息杂志日报资讯,Cheng,2017-02-10,人民日报数字报，时政新闻信息。,5.0
好屋精选,1,3660,80%,生活房产,房产信息购房资讯新闻,好屋精选,2017-01-24,为买房者提供多维度精准楼盘搜索，找房更方便。精准搜索、贴心服务，第一时间获得消息，精致楼盘高清图片，楼盘细节一目了然。,4.0
炫表情,0,3653,0%,社交表情头像,表情图片表情大全搞笑表情包搞笑表情,炫表情,2017-01-23,炫表情提供海量动态表情图片，包含有搞笑表情、经典表情、可爱表情等各类表情图片，斗图必备神器。,0.0
风暴英雄小盒子,0,3635,0%,工具查询,游戏数据胜率排名游戏娱乐,风暴英雄小盒子,2017-01-24,风暴英雄小盒子提供简洁方便的游戏数据查询服务。可以快速查看各英雄胜率排名，同时还有快捷的英雄天赋推荐、英雄售价、各地图胜率/出场率等丰富数据。由微信公众号“暴雪大数据”出品。,0.0
